Y M C A's Maharashtra English School,382/383  Rasta Peth  Rasta Peth  Pune  Maharashtra 411011,Rasta Peth,Pune,Pune,Maharashtra,State,2026138804,,C,PUNE CENTRE
Nirmala Convent School,Kharadi  Nirmalwadi  Kharadi  Pune - 411 014,Kharadi,Pune,Pune,Maharashtra,State,2020265517,,C,PUNE CENTRE
Vidyanchal School, Sr no 258  259  Shambhu Vihar Society  Baner  Balaji Park  Pune  Maharashtra 411007,Aundh,Pune,Pune,Maharashtra,State,2027299576,vidyanchalschool@rediffmail.com,B,PUNE CENTRE
Akshara International School,S. No. 109  Opp. Prerana Bhavan  Wakad  Pune  Maharashtra 411057,Wakad,Pune,Pune,Maharashtra,CBSE,9225669778,admin@akshara.in,A+,PUNE CENTRE
RMD International School,Pawana Nagar Housing Society  Chinchwad  Pimpri-Chinchwad  Maharashtra 411033,Chinchwad,Pune,Pune,Maharashtra,CBSE,2069996049,info@rmdis.org,B,PUNE CENTRE
St Joseph Convent School- Wagholi,Nagar Road  Wagholi - 411014 Pune,Wagoli,Pune,Pune,Maharashtra,State,2032903277,stjosephnagarroad@gmail.com,B,PUNE CENTRE
VIDYA BHAWAN HIGH SCHOOL,Gokhale Nagar  Pune  Maharashtra 411016,Gokhale Nagar,Pune,Pune,Maharashtra,State,2025653413,bhavan.pune.kendra@gmail.com,B,PUNE CENTRE
SURYADATTA INTERNATIONAL SCHOOL,342  Pashan Rd  Patil Nagar  Bavdhan  Pune  Maharashtra 411021, Bavdhan,Pune,Pune,Maharashtra,CBSE,2067901317,,B,PUNE CENTRE
ROSARY SCHOOL - CAMP,No.14/3  Dr. Ambedkar Road  Camp  Pune  Maharashtra 411001, CAMP,Pune,Pune,Maharashtra,State,2026134668,,B,PUNE CENTRE
Dr. Kalmadi Shamarao High School  Kothrud,3 S.No 36  Erandwane  Pune  Maharashtra 411038,Erandwane,Pune,Pune,Maharashtra,State,2025456328,,A,PUNE CENTRE
Mount Carmel High School  Chandrapur,Mul Road  Shastri Nagar  Chandrapur  Maharashtra 442401,Chandrapur,Chandrapur,Chandrapur,Maharashtra,CBSE,7172271170,principal_mcchs@yahoo.com,A+,CHANDRAPUR CENTRE
St. Michaels School  State,Ramnagar  Chandrapur  Maharashtra 442402,Ram Nagar Chandrapur,Chandrapur,Chandrapur,Maharashtra,State,7172255253,st.michaelenlgishschool@gmail.com,A+,CHANDRAPUR CENTRE
Rosary School   Warje,Atul Nagar  Warje  Pune  Maharashtra 411058,Warje,Pune,Maharashtra,Pune,ICSE,2064002892,,B,PUNE CENTRE
Chanda Public School,Datala Road  Ramnagar  Chandrapur  Maharashtra 442402,Datala Road Chandrapur,Chandrapur,Chandrapur,Maharashtra,State,7172321514,chanda_public@rediffmail.com,A+,CHANDRAPUR CENTRE
Cresent High School ,Gultekdi   Near Salisbury Park  Behind Market Yard  Pune  Maharashtra 411037,Gultekdi,Pune,Pune,Maharashtra,State,2024265990,contact@chs.edu.in,C,PUNE CENTRE
Indira Gandhi garden school,Datala Rd  Ramnagar  Chandrapur  Maharashtra 442402,Datala Road Chandrapur,Chandrapur,Chandrapur,Maharashtra,CBSE,7172274200,r_puglia@rediffmail.com,A+,CHANDRAPUR CENTRE
Shree Maharishi Vidya Mandir,72/A Mauja  Datala  At Datala Road  Chandrapur  Maharashtra  Chandrapur  Maharashtra 442401,Datala Road Chandrapur,Chandrapur,Chandrapur,Maharashtra,State,7172272263,smvmchandrapur@gmail.com,A+,CHANDRAPUR CENTRE
BVB'S PARANJAPE VIDYA MANDIR,S. No. 40  Hissa No. 1  2  3  Near Kothrud Telephone Exchange  Kothrud  Pune - 411 038.,Kothrud,Pune,Pune,Maharashtra,State,2025388837,bvbpvm2002@gmail.com,B,PUNE CENTRE
Army Public School  Dehu Road ,COD Marg Dehu Road Pune 412101,Dehu Road,Pune,Pune,Maharashtra,CBSE,2027670266,apsdehuroad@gmail.com,B,PUNE CENTRE
Bhavan's Sulochana Natu Vidya Mandir,407 - 408  Dr. K.M. Munshi Marg  Off Senapati Bapat Rd  Bharatiya Vidya Bhavan Chowk  Shivaji Nagar ,Senapati Bapat Rd,Pune,Pune,Maharashtra,State,2025657372,principal.snvmsec@gmail.com,B,PUNE CENTRE
 Vidya Niketan dadawadi CBSE  Chandrapur, Vidya Niketan  Nagpur Road  Chandrapur 442402 Maharashtra,NAgpur Road Chandrapur,Chandrapur,Chandrapur,Maharashtra,CBSE,7172252490,vidyaniketancbse@gmail.com,A,CHANDRAPUR CENTRE
Vidya Niketan State, Nagpur Road  Chandrapur 442402 Maharashtra,NAgpur Road Chandrapur,Chandrapur,Chandrapur,Maharashtra,State,9433315645,,A,CHANDRAPUR CENTRE
DR VIKHE PATIL MEMORIAL SCHOOL,Off Senapati Bapat Road  Patrakar Nagar Road  Gokhalenagar  Pune  Maharashtra 411016,Senapati Bapat Road,Pune,Maharashtra,Pune,CBSE,2025658170,contact@vpmspune.org,A,PUNE CENTRE
Narayana Vidyalayam chandrapur,Ghuggus Road  Padoli  Chandrapur  Maharashtra 442406,Ghuggus Road Chandrapur,Chandrapur,Chandrapur,Maharashtra,CBSE,,,A+,CHANDRAPUR CENTRE
Hume McHenry Memorial Higher Secondary School and Junior College of SDA,S.D.A Campus  Salisbury Park  Gultekdi  Pune  Maharashtra 411037, Gultekdi,Pune,Pune,Maharashtra,ICSE,2064702666,humemchenry@gmail.com,B,PUNE CENTRE
J.N.PETIT TECHNICAL HIGH SCHOOL, 28  Bund Garden Road  Pune  Maharashtra 411001, Bund Garden Road,Pune,Pune,Maharashtra,State,2026164104,vsjnpetit@hotmail.com,B,PUNE CENTRE
JEEVAN VIDYA ENG MED SCHOOL,Karve Nagar  Pune  Maharashtra 411052,Karve Nagar ,Pune,Pune,Maharashtra,State,,,C,PUNE CENTRE
JNANPRABODHINI PRASHALA, 510  Near Hati Ganpathi Temple  Sadashiv Peth  Pune  Maharashtra ,Sadashiv Peth,Pune,Pune,Maharashtra,CBSE,2024207000,contact@jnanaprabodhini.org,A,PUNE CENTRE
St.Anne's Public School Warora,DWARKANAGARI BORDA ,warora,Chandrapur,Chandrapur,Maharashtra,State,7038212161,,A+,CHANDRAPUR CENTRE
Kendriya Vidyalaya Bhadravati,Nirmani Vasahat  Bhadravati  Maharashtra 442501,Bhadravati,Bhadrawati,Chandrapur,Maharashtra,CBSE,7175254447,ofchandakv@gmail.com,A,CHANDRAPUR CENTRE
St.Annes High School  Bhadravati,Sumthana  Bhadravati  Maharashtra 442902,Sumthana,Bhadrawati,Chandrapur,Maharashtra,CBSE,,,A,CHANDRAPUR CENTRE
Macaroon Student's Academy  Bhadravati,Ramnagar  Bhadravati  Maharashtra 442902,Ramnagar Bhadravati,Bhadrawati,Chandrapur,Maharashtra,CBSE,,,B,CHANDRAPUR CENTRE
St. Anne's High School,Mul,Mul,Mul,Chandrapur,Maharashtra,State,9423465210,,A,CHANDRAPUR CENTRE
Gurunanank Public School  Ballarpur,Rajura Road,Ballarpur,Chandrapur,Chandrapur,Maharashtra,CBSE,,noemailid@gmail.com,A,CHANDRAPUR CENTRE
Dilasagram Convent High School,Rajura Road,Ballarpur,Chandrapur,Chandrapur,Maharashtra,State,,noemailid@gmail.com,A,CHANDRAPUR CENTRE
Montfort School  Ballarpur,Ballarpur,Ballarpur,Chandrapur,Chandrapur,Maharashtra,State,,noemailid@gmail.com,A,CHANDRAPUR CENTRE
Navbharat High School   Mul,Mul,Mul,Mul,Chandrapur,Maharashtra,State,9423616254,,B,CHANDRAPUR CENTRE
Swami Vivekanand Vidyamandir   Mul,Mul,Mul,Mul,Chandrapur,Maharashtra,State,9423465210,,B,CHANDRAPUR CENTRE
Shri Shivaji high School,Rajura,Rajura,Chandrapur,Chandrapur,Maharashtra,State,,noemailid@gmail.com,B,CHANDRAPUR CENTRE
Stella Maris High School,Rajura,Rajura,Chandrapur,Chandrapur,Maharashtra,CBSE,,noemailid@gmail.com,A,CHANDRAPUR CENTRE
Stella Maris Convent,Rajura,Rajura,Rajura,Chandrapur,Maharashtra,State,,noemailid@gmail.com,B,CHANDRAPUR CENTRE
Ambuja Vidya Niketan  Gadchandur,Gadchandur,Gadchandur,Gadchandur,Chandrapur,Maharashtra,CBSE,7173240239,noemailid@gmail.com,A,CHANDRAPUR CENTRE
Holy Family Public School,Gadchandur,Gadchandur,Gadchandur,Chandrapur,Maharashtra,CBSE,,,A,CHANDRAPUR CENTRE
Santosh Math's Academy ,Rajura,Rajura,Gadchandur,Chandrapur,Maharashtra,State,,,A,CHANDRAPUR CENTRE
T G Sir,Rajura,Rajura,Rajura,Chandrapur,Maharashtra,State,9096095642,noemailid@gmail.com,A,CHANDRAPUR CENTRE
Chauhan Sir,Ballarpur,Ballarpur,Chandrapur,Chandrapur,Maharashtra,State,,,A+,CHANDRAPUR CENTRE
NEW ERA ENGLISH SCHOOL,jANKI nAGAR nEAR uDAY nAGAR sQ,UDAY NAGAR,Nagpur,Nagpur,Maharashtra,State,,,C,EAST CENTRE - NAGPUR
MOTGHARE MAM CLASSES,MOTGHARE COMPLEX SAKARDARA SQ,SAKARDARA,Nagpur,Nagpur,Maharashtra,State,7745863257,,C,EAST CENTRE - NAGPUR
ST ANTHONY HS,AJANI ,AJANI,Nagpur,Nagpur,Maharashtra,State,,,C,EAST CENTRE - NAGPUR
Shivaji High school  Gadchandur,Gadchandur,Gadchandur,Gadchandur,Chandrapur,Maharashtra,State,,noemailid@gmail.com,B,CHANDRAPUR CENTRE
Nagar Parishad  high school ,Morshi Road chandurBazar ,ChandurBazar,CHANDUR BAZAR,AMRAVATI,Maharashtra,State,9403055143,,C,AMRAVATI CENTRE
G.R.Kabra English School  Chandur Bazar,Morshi Road chandurBazar ,ChandurBazar,CHANDUR BAZAR,AMRAVATI,Maharashtra,State,,,C,AMRAVATI CENTRE
Jijamata English School Chandurbazar,Amravati Road Chandurbazar,ChandurBazar,CHANDUR BAZAR,AMRAVATI,Maharashtra,State,,,B,AMRAVATI CENTRE
Shivaji High School  Morshi ,Amravati Road Morshi ,Morshi,MORSHI,AMRAVATI,Maharashtra,State,9766016364,,A,AMRAVATI CENTRE
Jijamata English School  morshi,Amravati Road Morshi ,Morshi,AMRAVATI,AMRAVATI,Maharashtra,State,8007628103,,B,AMRAVATI CENTRE
SHANTINIKETAN ENGLISH SCHOOL  MORSHI,Morshi Road Amravati,Morshi,MORSHI,AMRAVATI,Maharashtra,State,,,B,AMRAVATI CENTRE
ST. VINCENT HIGH SCHOOL,No. 2005/2006  St. Vincent's Street  Camp  Pune  Maharashtra 411001,Camp,Pune,Pune,Maharashtra,State,2026352135,stvincentsschool@yahoo.co.in,A,PUNE CENTRE
ST. ANNE'S HIGH SCHOOL, 1998  Convent St  Camp  Pune  Maharashtra 411001,CAMP,Pune,Pune,Maharashtra,State,2026340840,annesjr.collegepune@gmail.com,A,PUNE CENTRE
ST JOSEPH GIRL'S CONVENT HIGH SCHOOL,9  Burr Rd  Khadki  Pune  Maharashtra 411003,KHADKI,Pune,Maharashtra,Pune,State,2025813325,josephkirkee@gmail.com,C,PUNE CENTRE
ACHARYA SHREE VIJAY VALLABH SCHOOL,111  Bhavani Peth  Pune - 42,Bhavani Peth,Pune,Pune,Maharashtra,State,2026354139,,C,PUNE CENTRE
Spicer Higher Secondary School,Shivajinagar  Pune  Maharashtra 411005,Shivajinagar ,Pune,Pune,Maharashtra,ICSE,2025882140,,B,PUNE CENTRE
Angels High School,Kadam Wakwasti  Loni Kalbhor  Pune - 412201,Hadapsar,Pune,Pune,Maharashtra,State,2026913722,angelhighschool.loni@gmail.com,C,PUNE CENTRE
SILVER CREST ENGLISH MEDIUM SCHOOL,Hingne Khurd  Behind HDFC Bank  Vitthalwadi  Pune  Maharashtra 411051,SINHGAD ROAD,Pune,Pune,Maharashtra,State,2024345455,zcoer@zealeducation.com,C,PUNE CENTRE
Army Public School  Kirkee,Deccan College Rd  Yerawada  Pune  Maharashtra 411006,Kirkee,Pune,Pune,Maharashtra,CBSE,2065004596,apskirkee11@gmail.com,B,PUNE CENTRE
Sevasadan English Medium School,1410   Patwardhan Baug  Near Dinanath Mangeshkar Hospital  Erandwane  Pune  Maharashtra 411004,Erandwane,Pune,Pune,Maharashtra,State,2025439263,,C,PUNE CENTRE
Balshikshan Manmandir English Medium School,25435733,Kothrud,Pune,Pune,Maharashtra,CBSE,2025435733,,B,PUNE CENTRE
Saraswati Vidyalaya Union Pre-Primary & Primary Schoo,309  Shankar Garvd Rd  Somwar Peth  Pune  Maharashtra 411011,Somwar Peth,Pune,Pune,Maharashtra,State,,,C,PUNE CENTRE
Samubai Mulchand Choksey High School And Junior College,1983  Convent Street  Camp  Pune  Maharashtra 411001,Camp,Pune,Pune,Maharashtra,State,2026340053,juniorcollege@smchoksey.com,B,PUNE CENTRE
GG International School,174-177  Swarganga  Vallabhnagar  Near The Muslim Co-operative Bank  Pimpri Colony  Pune  Maharashtr,Pimpri,Pune,Pune,Maharashtra,CBSE,9970170221,admin@myggis.orgttt,A,PUNE CENTRE
Rosary School- CAMP,No.14/3  Dr. Ambedkar Road  Camp  Pune  Maharashtra 411001,CAMP,Pune,Pune,Maharashtra,State,2026134668,,B,PUNE CENTRE
GLOBAL TALENT INTERNATIONAL SCHOOL,Plot no.1  Sector no.13 Mercedez Chowk  Off Spine Road  Chikhali Pradhikaran  Pune,Chikhali,Pune,Pune,Maharashtra,CBSE,8600335679,gtispune@gmail.com,A,PUNE CENTRE
New India School, Bhusari Colony  Opp.PMT Bus Depot  Paud Road  Kothrud  Pune  Maharashtra 411038, Kothrud,Pune,Pune,Maharashtra,CBSE,2025280291,nis.office@newindiaschool.org,A,PUNE CENTRE
GURUKUL SCHOOL- University Circle,S.No 136  Behind E-Square  Off Pune University Road  Near Vijay Housing Society  Pune 411016,Bhosalenagar,Pune,Pune,Maharashtra,CBSE,2025561421,gurukulpuneprincipal@gmail.com,B,PUNE CENTRE
St Anthony High School,Ajani,Ajani,Nagpur,Nagpur,Maharashtra,State,,,D,EAST CENTRE - NAGPUR
NCL  ENGLISH MEDIUM School,Pashan Circle  Pashan Road  Pashan Gaon  Pune  Maharashtra 411008, Pashan,Pune,Pune,Maharashtra,State,2025883036,,C,PUNE CENTRE
Muktangan English School & Jr. College, 44  Parvati  Nirmal Baug Colony  Vidyanagari  Parvati Paytha  Pune  Maharashtra 411009,Parvati Paytha,Pune,Pune,Maharashtra,State,2024220043,,B,PUNE CENTRE
Mother Theresa School & Junior College,Old Mundhwa Rd  Galande Nagar  Vadgaon Sheri  Pune  Maharashtra 411014,Vadgaon Sheri,Pune,Pune,Maharashtra,State,7775088712,,B,PUNE CENTRE
Hillgreen High School,S. No. 44/ 4/ 1  Holevasti  Pisoli Pune - 411 028  Maharashtra  India.,Undri,Pune,Pune,Maharashtra,State,2026970437,,B,PUNE CENTRE
LEXICON INTERNATIONAL SCHOOL - WAGHOLI,LEXICON ESTATE  G NO. 726 PUNE NAGAR ROAD  WAGHOLI PUNE-412207,Wagoli,Pune,Pune,Maharashtra,CBSE,2027051818,,A,PUNE CENTRE
LOYOLAS HIGH SCHOOL,Pashan Road opp Subamnshri Soc  Pashan Road  Pune,Pashan,Pune,Pune,Maharashtra,State,8380065790,,A,PUNE CENTRE
MANSUKHBHAI KOTHARI NATIONAL SCHOOL,H&M Royale S no:19  Opp. Talab Factory  Kondhwa  Pune 411048,Kondhwa,Pune,Pune,Maharashtra,CBSE,8605404256,kns.kothari@gmail.com,B,PUNE CENTRE
MIT Shree Sarawati Vidyalaya,127/1A  PAUD ROAD  KOTHRUD  PUNE  411038,Kothrud,Pune,Pune,Maharashtra,State,9850658107,,B,PUNE CENTRE
MSB Educational Institute,Sambhaji Nagar  Kondhwa Budruk  Pune  Maharashtra 411048,Kondhwa,Pune,Pune,Maharashtra,ICSE,2026940110,,C,PUNE CENTRE
Nanded City Public School,Nanded City  Singhad Road  Naded  Pune  Maharashtra 411041,Nanded City,Pune,Pune,Maharashtra,State,2067520113,,A,PUNE CENTRE
Pawar Public School- Amanora,Amanora Park Town  Sade Satra Nali  Hadapsar  Pune  Maharashtra 411028,Hadapsar,Pune,Pune,Maharashtra,CBSE,2026722290,info@ppspune.com,A,PUNE CENTRE
Podar International School- Chinchwad,Kakade Park  Opposite Talerao Hospital  Tanaji Nagar  Pimpri-Chinchwad  Maharashtra 411033,Chinchwad,Pune,Pune,Maharashtra,CBSE,2027611601,,A,PUNE CENTRE
Pratibha International School,Plot No. 3  Block D-III  Behind Mehta Hospital  Off Mumbai Pune Road  Pune  Maharashtra 411019,Chinchwad,Pune,Pune,Maharashtra,State,2064105505,info@kes.org.in,C,PUNE CENTRE
RIMS International School & Junior College,NIBM Post Office Rd  Kondhwa  Pune  Maharashtra 411048,Kondhwa,Pune,Pune,Maharashtra,ICSE,9371776616,info@rimsinternational.education,A,PUNE CENTRE
MITCON International School,Pune Octroi Naka  Near  Balewadi  Pune  Maharashtra 411045, Balewadi,Pune,Pune,Maharashtra,ICSE,9881461413,admissions@mis.edu.in,B,PUNE CENTRE
Millennium National School,18  Hill Side  Karvenagar  Pune  Maharashtra 411052,Karvenagar,Pune,Pune,Maharashtra,State,7798982020,,A,PUNE CENTRE
Mahesh Vidyalaya English Medium, Survey No. 50  Hissa 15/2  Shrikant Thakare Path  Nalawade Baug  Kothrud  Pune  Maharashtra 411038,Kothrud,Pune,Pune,Maharashtra,State,9370169445,admin@mvem.in,C,PUNE CENTRE
Ryan International School,Aditya Shagun Nisarg  Banglore by Pass  Bavdhan Road  Mokai Vasti  Pune  Maharashtra 411021,Bavdhan,Pune,Pune,Maharashtra,ICSE,9545738822,ris.bavdhan@ryangroup.org,A,PUNE CENTRE
Mahavir English Medium School and Junior College,472/A  Salisbury Park  Opposite Maharshinagar Police Station  Salisbury Park  Pune  Maharashtra 4110,Maharshinagar,Pune,Pune,Maharashtra,State,2024267255,,B,PUNE CENTRE
Lokseva e School,S.No. 129/2+148/1A  Behind Swami Smarth Society  Pashan-Sus Road  Pune  Maharashtra 411021,Pashan-Sus Road,Pune,Pune,Maharashtra,CBSE,2025871911,,A,PUNE CENTRE
P. Jog HIGH SCHOOL,57  Chatrapati Rajaram Maharaj Path  Mayur Colony  Kothrud  Pune  Maharashtra 411029, Kothrud,Pune,Pune,Maharashtra,State,2025531577,jogeducationaltrust@gmail.com,B,PUNE CENTRE
Kendriya Vidyalaya Southern Command,Tarapore Road  Near Parasi Gym Khana  Camp  Pune  Maharashtra 411001, Camp,Pune,Pune,Maharashtra,CBSE,2026361737,,B,PUNE CENTRE
Ryan international school,Aditya Shagun Nisarg  Banglore by Pass  Bavdhan Road  Mokai Vasti  Pune  Maharashtra 411021,Bavdhan,Pune,Pune,Maharashtra,ICSE,9545738822,ris.bavdhan@ryangroup.org,A,PUNE CENTRE
The Orchid School,Baner - Mhalunge Road  Baner  Pune: 411045,Baner,Pune,Pune,Maharashtra,CBSE,2065007680,contactus@theorchidschool.org,A,PUNE CENTRE
Ornellas High School,Plot No. 433  Nana Peth  Quarter Gate  City Church Compound  Pune  Maharashtra 411002,Nana Peth,Pune,Pune,Maharashtra,State,2026136276,,C,PUNE CENTRE
Sanskriti School -Bhukum,Near Manas Lake  Ahead of Chandani Chowk  Pune  Mulshi Road  Pune  412 115,Bhukum,Pune,Pune,Maharashtra,CBSE,9272220303,,A+,PUNE CENTRE
Sanskriti School -NIBM,Survey Number 12  13 Near Kumar Princetown PIN  Link Rd Undrigaon  Undri  Pune  Maharashtra 411060,Undri,Pune,Pune,Maharashtra,CBSE,7719048003,,B,PUNE CENTRE
St. Patrick's High School and Junior College, No. 1B  Prince of Wales Dr Rd  Camp  Pune  Maharashtra 411001,CAMP,Pune,Pune,Maharashtra,State,2026360575,,A,PUNE CENTRE
Sanskriti school wagholi,Main Nagar Road  Survey Number 571  Wagholi,Wagoli,Pune,Pune,Maharashtra,CBSE,9272220404,,A,PUNE CENTRE
Sant dnyaneshwar english medium school,Survey No 43/1/2  Pathare Thube Nagar Tube Pathare Wasti Kharadi  Nagar Road  Chandan Nagar-kharadi ,Kharadi,Pune,Pune,Maharashtra,State,2020264062,,C,PUNE CENTRE
St. Felix High School,4  Boat Club Rd  Bund Garden  Sangamvadi  Pune  Maharashtra 411001, Bund Garden,Pune,Pune,Maharashtra,State,2026128693,stfelixjmpn@gmail.com,A,PUNE CENTRE
SNBP world school- Moshi,River Residency  GAT no 90 Chikhali  Pimpri-Chinchwad  Maharashtra,Chikhali,Pune,Pune,Maharashtra,State,7774059640,snbp.moshi@gmail.com,B,PUNE CENTRE
SS English Medium School,48 Mohanwadi Yerwada   Pune  Maharashtra 411006,Yerawada,Pune,Pune,Maharashtra,State,2026697196,,B,PUNE CENTRE
SSPM Day School & Jr College,Near Rto  Kennedy Road  Pune  Maharashtra 411001,Near Rto,Pune,Pune,Maharashtra,State,2026058753,,A,PUNE CENTRE
Sri Sri Ravishankar Vidya Mandir  Bhugaon,S. No.84/2  Forest Township  Paranjape Schemes Matalwadi Road  Near Manas Lake  Bhugaon  Pune  Mahar, Bhugaon,Pune,Pune,Maharashtra,State,7709107388,pune.bhugaon@ssrvm.org,A,PUNE CENTRE
Sinhgad City School, Survey no. 50/1  Kondhwa Saswad Road  Tilekar Nagar  Kondhwa Budruk  Pune  Maharashtra 411048,Kondhwa,Pune,Pune,Maharashtra,CBSE,2064783011,,B,PUNE CENTRE
Marot Rao Mude High School,Hudkeshwar Road High School,Hudkeshwar Road High School,Nagpur,Nagpur,Maharashtra,State,7517734646,info@mmjrc.org,C,EAST CENTRE - NAGPUR
Sanskar Vidya Sagar,Deo Nagar,Deo Nagar,Nagpur,Nagpur,Maharashtra,State,8446010932,svsdeonagar@gmail.com,B,HEAD OFFICE -NAGPUR
Jack And Jill Public School,Prashant Nagar  MOTI NAGAR  AMRAVATI,AMRAVATI,AMRAVATI,AMRAVATI,Maharashtra,State,,,B,AMRAVATI CENTRE
Vianney Vidya Mandir,Ghugus,Ghugus,Ghugus,Chandrapur,Maharashtra,ICSE,,,A,CHANDRAPUR CENTRE
D.A.V. Public School,Wani,Neeljay  Wani,Wani,Yavatmal,Maharashtra,CBSE,8788154688,,A+,RESIDENTIAL CENTRE
Lions English Medium School,Wani,Wani,Wani,Yavatmal,Maharashtra,State,,,B,RESIDENTIAL CENTRE
Rekha Mam Classes,Warora,Warora,Chandrapur,Chandrapur,Maharashtra,CBSE,,,A+,RESIDENTIAL CENTRE
Ajay Borle's Coaching Classes,Bhadrawati,Bhadrawati,Bhadrawati,Chandrapur,Maharashtra,CBSE,,,A,CHANDRAPUR CENTRE
St. Arnold's central school,Adarsh Nagar  Vadgaon Sheri  Pune  Maharashtra 411014,vadgaon Sheri,Pune,Pune,Maharashtra,CBSE,2027037121,school@arnoldcentralschool.org,B,PUNE CENTRE
St. Clares high school,433  Nana Peth  Near YMCA Building  Pune  Maharashtra 411002,Rastapeth,Pune,Pune,Maharashtra,State,2026137507,,C,PUNE CENTRE
St. Josephs convent - nagar road,Nagar Road  Wagholi Pune.,Wagoli,Pune,Pune,Maharashtra,State,9371031776,,B,PUNE CENTRE
SVVNS- Saraswati Vishwa Vidyalaya National School,Plot no G/P 188  G block  Thermax chowk  MIDC  Chinchwad  Pune 411019,Chinchwad,Pune,Pune,Maharashtra,State,7721817000,support@svvns-chinchwad.org,C,PUNE CENTRE
Symbiosis school- Prabhat Road,15th Lane  Prabhat Road  Pune  411004,Deccan,Pune,Pune,Maharashtra,State,2025659357,sspune@symbischools.ac.in,B,PUNE CENTRE
Trinity international school,KONDHWA ANNEXE - SASWAD ROAD  BOPDEO GHAT  PUNE-48,Kondhwa,Pune,Pune,Maharashtra,CBSE,8888866610,,C,PUNE CENTRE
Vatsalya school & jr college, S. No. - 16  Mauje Wadachiwadi  Undri  Tehsil Haveli  Postal Code - 411026 Pune  Maharashtra ,Undri,Pune,Pune,Maharashtra,CBSE,7507441419,info@thevatsalyaschool.org,B,PUNE CENTRE
Vidya niketan eng med school,S. No. 634/9A/1  Canara Bank Lane  Shelar Rd  Ramya Nagari  Bibvewadi  Pune  Maharashtra 411037,Bibvewadi,Pune,Pune,Maharashtra,State,2024229422,,C,PUNE CENTRE
Vidya valley school,94/1  Sus Village  Taluka Mulshi . Pune 411021,Sus,Pune,Pune,Maharashtra,ICSE,2065339984,info@vidyavalley.com,B,PUNE CENTRE
Wisdom world school- Rahatani,Survey No. 210  Park Street  Aundh Chest Hospital Road  Near Kalewadi Chowk  Pune  Maharashtra 41105,Rahatani,Pune,Pune,Maharashtra,ICSE,2066309595,info_wakad@wisdomworldschool.in,A,PUNE CENTRE
Wisdom world school -Hadapsar,Kumar Picasso 201 Part  Pune  Maharashtra 411028,Hadapsar,Pune,Pune,Maharashtra,ICSE,8087782000,info_hadapsar@wisdomworldschool.in,A,PUNE CENTRE
Sinhgad Spring Dale Public Schools,Survey No 44/1  Off Sinhgad Road  Wadagaon Budruk  Pune  Maharashtra 411041, Sinhgad Road,Pune,Pune,Maharashtra,CBSE,2024357066,,B,PUNE CENTRE
Sinhgad Spring Dale School  Ambegaon,10/1 Sinhgad Institute Rd  Ambegaon Rd  Pune  Maharashtra 411041, Ambegaon,Pune,Pune,Maharashtra,CBSE,2024350488,,B,PUNE CENTRE
Gurunanak Public School,Gurdwara Road Near Race Course  Pune-411001 ,Camp,Pune,Pune,Maharashtra,State,226362350,gurunanakpublicschool@gmail.com,C,PUNE CENTRE
City international school  Kothrud,City Intenational School Survey No. 79  Opp Eklavya Polytechnic College New D. P. Road  Kothrud  Pun,Kothrud,Pune,Pune,Maharashtra,State,2025280205,info@cisk.in,A,PUNE CENTRE
City international school  Wanowrie,Fatima Nagar  Opp. Mahatma Phule Sanskrutik Bhawan  Wanowrie  Pune  Maharashtra 411040,Wanowrie,Pune,Pune,Maharashtra,CBSE,2026873530,wanowrie@cityinternationalschool.edu.in,A,PUNE CENTRE
City pride school  Nigdi,HS-2  Sector No. : 27A Near Sant Tukaram Garden Pradhikaran  Nigadi  Pune  Maharashtra 411044,Nigdi,Pune,Pune,Maharashtra,CBSE,2065105596,info@cityprideschool.com,A,PUNE CENTRE
Dr. (Mrs)Erin N. Nagarwala Day School,No 3  Kalyani Nagar  Off Nagar Road  Pune - 411 006,Kalyaninagar,Pune,Pune,Maharashtra,State,2026689176,info@nagarvalaschool.org,B,PUNE CENTRE
DSK school,DSK Vishwa Off Sinhagad Road  Dhayari Pune 41,Dhayari,Pune,Pune,Maharashtra,ICSE,2024380047,dsk.school@yahoo.co.in,A,PUNE CENTRE
Rosary School,  Opp.IDBI Bank  Bibvewadi Rd  Vasant Baug Society  Maharshi Nagar  Pune  Maharashtra 411037,Bibvewadi,Pune,Pune,Maharashtra,State,2065297314,,B,PUNE CENTRE
Rosary School  Viman Nagar,S. No. 106   Plot No. 18  Tasmac Road.  Viman Nagar  Pune  Maharashtra 411014, Viman Nagar,Pune,Pune,Maharashtra,State,2032335376,,A,PUNE CENTRE
RMD Sinhgad School of Engineering, Survey No. 111/1  Pune-Mumbai Bypass Highway  AtulNagar Phase I  Atul Nagar  Warje  Pune  Maharasht, Warje,Pune,Pune,Maharashtra,CBSE,2025218401,,B,PUNE CENTRE
Rewachand Bhojwani Academy , 5  Stevely Road  Camp  PMC  Pune  Maharashtra 411001, Camp,Pune,Pune,Maharashtra,ICSE,2026360368,,A,PUNE CENTRE
Pune International School,Survey No. 33  2  Lane Number 14  Vidyanagar  Tingre Nagar  Pune  Maharashtra 411032,Tingre Nagar,Pune,Pune,Maharashtra,State,2060120707,puneinternational@gmail.com,C,PUNE CENTRE
Phoenix English Medium School, Tukaram Nagar  Kharadi  Pune  Maharashtra 411014,Kharadi,Pune,Pune,Maharashtra,State,2065103304,,B,PUNE CENTRE
Pune Global School & Junior College of Science,100' Feet Bibwewadi-Kondhwa Road  Bibwewadi  Pune  Maharashtra 411037,Bibwewadi-Kondhwa Road,Pune,Pune,Maharashtra,State,2024261411,,B,PUNE CENTRE
Kroot Memorial School,T2/11  Oxford Village  SRPF  Wanowrie  Pune  Maharashtra 411040, Wanowrie,Pune,Pune,Maharashtra,State,,,B,PUNE CENTRE
Kroot Memorial School,T2/11  Oxford Village  SRPF  Wanowrie  Pune  Maharashtra 411040, Wanowrie,Pune,Pune,Maharashtra,State,,,B,PUNE CENTRE
Kendriya Vidyalaya Army Area, DAD Complex  Wanwari Range  Lulla Nagar  Pune  Maharashtra 411040, Lulla Nagar,Pune,Pune,Maharashtra,CBSE,2026830011,info@rcsindia.co.in,B,PUNE CENTRE
Kendriya Vidyalaya  NDA, NDA Campus  Kendriya Vidyalaya Road  Pune  Maharashtra 411023,NDA Campus,Pune,Pune,Maharashtra,CBSE,2025290092,,B,PUNE CENTRE
Kendriya Vidyalaya CME,Phugewadi  Dapodi  Pimpri-Chinchwad  Maharashtra 411031, Dapodi,Pune,Pune,Maharashtra,CBSE,2027145838,kvcmepune31@gmail.com,B,PUNE CENTRE
KENDRIYA VIDYALAYA No 2 AIR FORCE STATION, Lohegaon Road Near Pune Airport  Tingre Nagar  Pune  Maharashtra 411032, Chandan Nagar,Pune,Pune,Maharashtra,CBSE,2026684914,kv2afspune@gmail.com,B,PUNE CENTRE
Kendriya Vidyalaya No. 1  AFS,Air Force Station  Near Canara Bank  New Project Area  Lohegaon Road  Lohegaon  Pune  Maharashtra 41,Lohegaon,Pune,Pune,Maharashtra,CBSE,2026687656,principalkv1afspune@gmail.com,B,PUNE CENTRE
Jyotirmay International School,Opp Wageshwar Temple  Gat No 2188 A  Pl No. 8 & 9 A  Bhd. Rambhau Moze Engineering College  BAIF Rd ,Wagoli,Pune,Pune,Maharashtra,CBSE,2065100784,info@jyotirmay.org,C,PUNE CENTRE
JSPM Prodigy Public School,Gat No. 720 / 1 & 2  Wagholi   Pune-Ahmednagar Highway  Pune   Maharashtra 412207,Wagholi,Pune,Pune,Maharashtra,CBSE,8308840931,jspmpps@gmail.com,B,PUNE CENTRE
Eon Gyanankur English school, Rakshak Nagar  Kharadi  Pune  Maharashtra 411014,Kharadi,Pune,Pune,Maharashtra,CBSE,2065307171,cbsc_kharadi@pdeapune.org,B,PUNE CENTRE
Don Bosco High School,Shastri Nagar Chowk  Near IBM  Loop Rd  Yerawada  Pune  Maharashtra 411006, Yerawada,Pune,Pune,Maharashtra,State,2026686527,donboscoyervada@yahoo.com,C,PUNE CENTRE
Dnyanadeep English Medium School, Opposite Old Tol Naka  Katraj-Dehu Highway  Wadgon  Sun City Road  Anandnagar  Pune  Maharashtra 41,Wadgon,Pune,Pune,Maharashtra,State,2024354339,,C,PUNE CENTRE
Shri Guru Govind singh,Near Gurudwara  kamptee rod,nagpur,Nagpur,Nagpur,Maharashtra,State,,,C,SADAR CENTRE- NAGPUR
Aranyeshwar English Medium School, Sahakarnagar  Pune  Maharashtra 411001, Sahakarnagar ,Pune,Pune,Maharashtra,State,2024223618,,C,PUNE CENTRE
Amanora School, Amanora Park Town  194 Village  Mundhwa Road  Malwadi Rd  Sade Satra Nali  Hadapsar  Pune  Maharash, Amanora Park,Pune,Pune,Maharashtra,ICSE,7304491111,admissions@amanoraschool.edu.in,B,PUNE CENTRE
