ROYAL ACADAMY,Mumbai Naka road,Nashik,Peth,NASHIK,Maharashtra,CBSE,,,A,NASHIK CENTRE
Sadhana Classes,Takli signal dwarka,Nashik,Peth,NASHIK,Maharashtra,State,,,A,NASHIK CENTRE
Millenium english school,Pisadevi  road Arti nagar  Misarwadi Aurangabad-431003,Aurangabad ,Aurangabad,Aurangabad,Maharashtra,State,9665962965,,A,AURANGABAD CENTRE
Sanskar Foundation ,Mayur Park Jay Bhavani Chowk Aurangabad 431001 ,Mayur Park Jay Bhavani Chowk Aurangabad 431001 ,Aurangabad,Aurangabad,Maharashtra,State,9766216139,,A,AURANGABAD CENTRE
New Horizon English School,Roja Baug Hudco corner  Aurangabad-431001,Aurangabad ,Aurangabad,Aurangabad,Maharashtra,State,8421951192,,A,AURANGABAD CENTRE
SNT JOHN ENGLISH SCHOOL,TV Center Mayur Park Road ,TV Center Mayur Park Road ,Aurangabad,Aurangabad,Maharashtra,State,,namitapnbis@gmail.com,A,AURANGABAD CENTRE
Kalawati High School, Shivaji Nagar Rd  12th Scheme  Sara Raaj Nagar  Garkheda  Chhatrapati Sambhajinagar (Aurangabad)  M,Aurangabad,Aurangabad,Aurangabad,Maharashtra,State,9421182404,,B,AURANGABAD CENTRE
JIJAmata English School,N5 Jijamata Nagar,N5 Jijamata Nagar,Aurangabad,Aurangabad,Maharashtra,State,9168907860,,C,AURANGABAD CENTRE
SARSWATI SCHOOL,Kamlapur raod  Ranjangaon Aurangabad- 431136,Aurangabad ,Gangapur,Aurangabad,Maharashtra,State,9657583897,,B,AURANGABAD CENTRE
WORD SCHOOL, N6  Torna Nagar Cidco, N6  Torna Nagar Cidco,Aurangabad,Aurangabad,Maharashtra,CBSE,9687692879,,A,AURANGABAD CENTRE
Sant Xaviers English School,N 1  Near Cidco Guest House MIDC Industrial zone  town center  Chhatrapati Sambhajinagar,Aurangabad,Aurangabad,Aurangabad,Maharashtra,State,9326853770,,A,AURANGABAD CENTRE
VR SCHOLERDON,N8 Cidco ,N8 Cidco ,Aurangabad,Aurangabad,Maharashtra,CBSE,8975461106,,A,AURANGABAD CENTRE
RAJASHI SHAHU SCHOOL,Kamlapur raod  Ranjangaon Aurangabad- 431136,Aurangabad ,Gangapur,Aurangabad,Maharashtra,State,9403075110,,B,AURANGABAD CENTRE
MUKUL MANDIR,N7 CIDCO,N7 CIDCO,Aurangabad,Aurangabad,Maharashtra,State,9372353610,,A,AURANGABAD CENTRE
NEW HIGH SCHOOL,MIDC Industrial Area  Chilkalthana  Chhatrapati Sambhajinagar (Aurangabad)  Maharashtra 431006,Aurangabad,Aurangabad,Aurangabad,Maharashtra,State,9422970853,,A,AURANGABAD CENTRE
HAPPY CHILD SCHOOL,Ranjangao Sp road Waluj Aurangabad- 431133,Aurangabad ,Gangapur,Aurangabad,Maharashtra,State,7666553041,,A,AURANGABAD CENTRE
OYSTER HIGH SCHOOL,Sindhi Colony ,Sindhi Colony Jalna Road,Aurangabad,Aurangabad,Maharashtra,State,9561522796,,A+,AURANGABAD CENTRE
GURUKUL ENGLISH SCHOOL,Shenpunji Ranjangaon -431133,Gangapur ,Gangapur,Aurangabad,Maharashtra,State,8855924125,,A,AURANGABAD CENTRE
BLUE BUDS ENGLISH SCHOOL,Mayurban Colony  Gadia Vihar  Aurangabad  Maharashtra  431005,AURANGABAD,Aurangabad,Aurangabad,Maharashtra,State,,,B,AURANGABAD CENTRE
UNIVERSAL HIGH SCHOOL,Near Garware stadium ,Near Garware stadium ,Aurangabad,Aurangabad,Maharashtra,CBSE,,,A+,AURANGABAD CENTRE
Varad High School / Rajhans vidyalay,N2 Cidco  Near Mukundwadi Railway Station Aurangabad,Aurangabad,Aurangabad,Aurangabad,Maharashtra,State,8805686770,,A,AURANGABAD CENTRE
GAJANAN ENGLISH SCHOOL,Kamlapur raod  Ranjangaon Aurangabad- 431136,Gangapur ,Gangapur,Aurangabad,Maharashtra,State,8308607145,,A,AURANGABAD CENTRE
RENUKA HIGHSCHOOL,Satara Parisar  Peshve Nagar  Chhatrapati Sambhajinagar  Maharashtra  431005,AURANGABAD,Aurangabad,Aurangabad,Maharashtra,State,,,B,AURANGABAD CENTRE
WISDOM SCHOOL,Mayur Park Jay Bhavani Chowk Aurangabad 431001 ,Mayur Park Jay Bhavani Chowk Aurangabad 431001 ,Aurangabad,Aurangabad,Maharashtra,State,7972012935,,A,AURANGABAD CENTRE
LOHKARE HIGHSCHOOL,Kamlapur raod  Ranjangaon Aurangabad- 431136,Gangapur ,Gangapur,Aurangabad,Maharashtra,State,8830632224,,B,AURANGABAD CENTRE
DREAM LAND HIGH SCHOOL,Mayur Park Jay Bhavani Chowk Aurangabad 431001 ,Mayur Park Jay Bhavani Chowk Aurangabad 431001 ,Aurangabad,Aurangabad,Maharashtra,CBSE,9049595746,,A,AURANGABAD CENTRE
GALAXY ENGLISH SCHOOL,Sangram Nagar  Chhatrapati Sambhajinagar  Maharashtra  431005,AURANGABAD,Aurangabad,Aurangabad,Maharashtra,State,,,B,AURANGABAD CENTRE
Anand Dham English School,Kanchanwadi  Aurangabad,Aurangabad,Aurangabad,Aurangabad,Maharashtra,State,9049709675,,B,AURANGABAD CENTRE
SWAMI VIVEKANT SCHOOL,Kamlapur raod  Ranjangaon Aurangabad- 431136,Gangapur ,Gangapur,Aurangabad,Maharashtra,State,8668525657,,A,AURANGABAD CENTRE
ORIENT SCHOOL,Mayur Park Jay Bhavani Chowk Aurangabad 431001 ,Mayur Park Jay Bhavani Chowk Aurangabad 431001 ,Aurangabad,Aurangabad,Maharashtra,CBSE,8975197677,,A,AURANGABAD CENTRE
Kranti Public School ,Shenpunji Ranjangaon -431133,Gangapur ,Gangapur,Aurangabad,Maharashtra,State,8087118181,,B,AURANGABAD CENTRE
MORAL KIDS ENGLISH SCHOOL,Deolali  Chhatrapati Sambhajinagar  Maharashtra  431010,AURANGABAD,Aurangabad,Aurangabad,Maharashtra,State,,,A,AURANGABAD CENTRE
BALIRAM PATIL,N8 Cidco ,N8 Cidco ,Aurangabad,Aurangabad,Maharashtra,State,,,C,AURANGABAD CENTRE
DESHMUKH INTERNATIONAL SCHOOL,Phase IV opposite Benchmark Guest House   Nakshtrawadi  Chh. Sambhajinagar  43101,Aurangabad,Aurangabad,Aurangabad,Maharashtra,CBSE,8975273445,,A+,AURANGABAD CENTRE
VENUTAI CHAVAN HIGH SCHOOL,N8 Cidco ,N8 Cidco ,Aurangabad,Aurangabad,Maharashtra,State,,,C,AURANGABAD CENTRE
SANT.MEERA SCHOOL,Near Chatrapati college N-3 Cidco  Aurangabad- 431001 ,Aurangabad ,Aurangabad,Aurangabad,Maharashtra,State,9561164200,,A,AURANGABAD CENTRE
UJWALATAI PAWAR CBSE SCHOOL,Beed Bypass Road  Sangram Nagar  Chhatrapati Sambhajinagar (Aurangabad)  Maharashtra 431010,AURANGABAD,Aurangabad,Aurangabad,Maharashtra,CBSE,,,A,AURANGABAD CENTRE
ACE ACADEMY ,N1 Near MIDC Police Station ,N1 Near MIDC Police Station ,Aurangabad,Aurangabad,Maharashtra,State,,,A,AURANGABAD CENTRE
SHARADA BAHUUDDESHIYA SCHOOL,Pisadevi  road Arti nagar Aurangabad-431003,Aurangabad ,Aurangabad,Aurangabad,Maharashtra,State,9960252536,,B,AURANGABAD CENTRE
SANT KABIR SCHOOL,Kanchanwadi  Aurangabad 431011,Aurangabad,Aurangabad,Aurangabad,Maharashtra,State,9421410069,,B,AURANGABAD CENTRE
BHAGYALAKSHMI SARALA GURUSHANI MEMORIAL SCHOOL,Pundalik Nagar Aurangabad-431001,Aurangabad ,Aurangabad,Aurangabad,Maharashtra,State,8888801842,,A,AURANGABAD CENTRE
Paramount English School,Near VIP Hall Madni Chowk,Near VIP Hall Madni Chowk,Aurangabad,Aurangabad,Maharashtra,State,,,A,AURANGABAD CENTRE
ROYAL OAKS WORLD SCHOOL,Deolai  Chhatrapati Sambhajinagar (Aurangabad)  Maharashtra 431007,AURANGABAD,Aurangabad,Aurangabad,Maharashtra,CBSE,,,A+,AURANGABAD CENTRE
Crescent English School,Near Central Naka ,Near Central Naka ,Aurangabad,Aurangabad,Maharashtra,State,,,A,AURANGABAD CENTRE
SHAMBHURAJE VIDYALAY,Shambhuraje School Road Near Chhatrapati Krida Sankul  Deolai  Chauk  Satara Parisar  Chhatrapati Sa,AURANGABAD,Aurangabad,Aurangabad,Maharashtra,State,,,B,AURANGABAD CENTRE
GEETA VIDYA MANDIR,SECTOR 5  SHIVAJINAGAR GARKHEDA AURANGABAD  431001,Aurangabad,Aurangabad,Aurangabad,Maharashtra,State,9552668311,,A,AURANGABAD CENTRE
Foster English School,Near Central Naka,Near Central Naka,Aurangabad,Aurangabad,Maharashtra,State,,,A,AURANGABAD CENTRE
TEJASWINI SCHOOL,Garkheda parisar Aurangabad- 431001,Aurangabad ,Aurangabad,Aurangabad,Maharashtra,State,7028577579,,A,AURANGABAD CENTRE
Amanullah Motiwala School,Times Colony ,Times Colony,Aurangabad,Aurangabad,Maharashtra,State,,,A,AURANGABAD CENTRE
IDEAL ZONE ENGLISH SCHOOL,Pundalik Nagar Aurangabad-431001,Aurangabad ,Aurangabad,Aurangabad,Maharashtra,State,9423849501,,A,AURANGABAD CENTRE
SHREE SAMARTH HIGHSCHOOL,R9V3+96V  Said Nagar  Vijayant Nagar  Satara Deolai Parisar  Chhatrapati Sambhajinagar (Aurangabad) ,AURANGABAD,Aurangabad,Aurangabad,Maharashtra,State,,,A,AURANGABAD CENTRE
Montfort English School,Kat Kat Gate Road near Kat kat Gate,Kat Kat Gate Road near Kat kat Gate,Aurangabad,Aurangabad,Maharashtra,State,,,B,AURANGABAD CENTRE
MEHARSINGH NAIK HIGH SCHOOL,  Garkheda Parisar   Chhatrapati Sambhajinagar (Aurangabad)  Maharashtra 431005,Aurangabad,Aurangabad,Aurangabad,Maharashtra,State,9657286538,,B,AURANGABAD CENTRE
SHREE VENKATESH HIGH SCHOOL,Deolai  Chhatrapati Sambhajinagar (Aurangabad)  Maharashtra 431007,AURANGABAD,Aurangabad,Aurangabad,Maharashtra,State,,,B,AURANGABAD CENTRE
Prime Star English School,Kat Kat Gate Road near Kat kat Gate,Kat Kat Gate Road near Kat kat Gate,Aurangabad,Aurangabad,Maharashtra,State,,,A,AURANGABAD CENTRE
NEW ENGLISH HIGHSCHOOL,36  Ayappa Mandir Rd  Gopi Nath Pura  Deolai  Chhatrapati Sambhajinagar (Aurangabad)  Maharashtra 43,AURANGABAD,Aurangabad,Aurangabad,Maharashtra,State,,,C,AURANGABAD CENTRE
BOON INTERNATIONAL SCHOOL,Hunaji Nagar Jatwada,Hunaji Nagar Jatwada,Aurangabad,Aurangabad,Maharashtra,State,,,A,AURANGABAD CENTRE
DR.R.P. NATH HIGH SCHOOL,SARA RAAJ  GARKHEDA AURANGABAD 431007,Aurangabad,Aurangabad,Aurangabad,Maharashtra,State,9421677969,,C,AURANGABAD CENTRE
WINCHESTER HIGH SCHOOL,Op. Sara Vaibhav Jatwada,Op. Sara Vaibhav Jatwada,Aurangabad,Aurangabad,Maharashtra,CBSE,,,A,AURANGABAD CENTRE
LAL BAHADUR SHASTRI HIGHSCHOOL,1213  Sainagar  Waluj  Chhatrapati Sambhajinagar (Aurangabad)  Wadgaon Kolhati  Maharashtra 431136,AURANGABAD,Aurangabad,Aurangabad,Maharashtra,State,,,B,AURANGABAD CENTRE
DNYANDA HIGH SCHOOL,Pisa Devi Palshi,Pisa Devi Palshi,Aurangabad,Aurangabad,Maharashtra,CBSE,,,A,AURANGABAD CENTRE
RYAN INTERNATIONAL SCHOOL,Paithan Road Bidkin,Paithan Road Bidkin,Aurangabad,Aurangabad,Maharashtra,CBSE,,,A,AURANGABAD CENTRE
ROYAL SCHOOL,Savta Market  Ranjangaon SP Rd  Ranjangaon Shenpunji  Waluj  Chhatrapati Sambhajinagar (Aurangabad) ,AURANGABAD,Aurangabad,Aurangabad,Maharashtra,State,,,B,AURANGABAD CENTRE
VIDYANIKETAN HIGH SCHOOL,NEAR HANUMAN NAGAR GARKHEDA PARISAR AURANGABAD,Aurangabad,Aurangabad,Aurangabad,Maharashtra,State,8888962010,,B,AURANGABAD CENTRE
PEARLS ACADEMY,Harsul Sawangi,Harsul Sawangi,Aurangabad,Aurangabad,Maharashtra,CBSE,,,A,AURANGABAD CENTRE
Harsul Sawangi,Harsul Sawangi,Harsul Sawangi,Aurangabad,Aurangabad,Maharashtra,CBSE,,,A,AURANGABAD CENTRE
MAHAVIR HIGHSCHOOL,P 110  Colgate Chowk  MIDC Waluj  Bajaj Nagar  Ranjangaon Shenpunji  Waluj  Chhatrapati Sambhajinaga,AURANGABAD,Aurangabad,Aurangabad,Maharashtra,State,,,B,AURANGABAD CENTRE
SANSKAR PRABHODINI,Harsul Sawangi,Harsul Sawangi,Aurangabad,Aurangabad,Maharashtra,CBSE,,,A,AURANGABAD CENTRE
M.S.P MADHYAMIK VIDYALAY,N4   CIDCO  AURANGABAD,Aurangabad,Aurangabad,Aurangabad,Maharashtra,State,8275388223,,B,AURANGABAD CENTRE
Dr. Desarda Public School,Opp. Apex Hospital ,Opp. Apex Hospital ,Aurangabad,Aurangabad,Maharashtra,State,,,A,AURANGABAD CENTRE
SANSKAR PRABODHINI SCHOOL,RANJANGAON  WALUJ  AURANGABAD ,AURANGABAD,Aurangabad,Aurangabad,Maharashtra,State,,,C,AURANGABAD CENTRE
SHREYASH HIGH SCHOOL,SHREYASH COLONY JOTI NAGAR ROAD AURANGABAD,Aurangabad,Aurangabad,Aurangabad,Maharashtra,State,7720037504,,B,AURANGABAD CENTRE
Un Naba Internationa School,Central Naka,Central Naka,Aurangabad,Aurangabad,Maharashtra,State,,,A,AURANGABAD CENTRE
TRIMURTI HIGHSCHOOL,P-107 Bajajnagar  Waluj.  Chhatrapati Sambhajinagar (Aurangabad)  Maharashtra 431001,AURANGABAD,Aurangabad,Aurangabad,Maharashtra,State,,,C,AURANGABAD CENTRE
Suprem Global English School,Near Jenci Police station Roshan Gate,Near Jenci Police station Roshan Gate,Aurangabad,Aurangabad,Maharashtra,State,,,A+,AURANGABAD CENTRE
JIVA PATEL HIGH SCHOOL,MUKUNDWADI STATION ROAD  AURANGABAD,Aurangabad,Aurangabad,Aurangabad,Maharashtra,State,9423388523,,B,AURANGABAD CENTRE
Little Flower  English School,Cantonment  Aurangabad-431002  Maharashtra  India.,Aurangabad ,Aurangabad,Aurangabad,Maharashtra,State,9420265588,,A,AURANGABAD CENTRE
AURANGABAD PUBLIC SCHOOL,Shop No  1  Hitech College Rd  Bajaj Nagar  Waluj  Chhatrapati Sambhajinagar (Aurangabad)  Wadgaon K,AURANGABAD,Aurangabad,Aurangabad,Maharashtra,CBSE,,,A,AURANGABAD CENTRE
Creative International School,Near Jenci Police station Roshan Gate,Near Jenci Police station Roshan Gate,Aurangabad,Aurangabad,Maharashtra,CBSE,,,B,AURANGABAD CENTRE
TANWANI SCHOOL,R6VQ+XGJ  Tanwani School Rd  Bajaj Nagar  Waluj  Chhatrapati Sambhajinagar (Aurangabad)  Wadgaon Kol,AURANGABAD,Aurangabad,Aurangabad,Maharashtra,CBSE,,,A,AURANGABAD CENTRE
SHAHEED BHAGATSINGH HIGHSCHOOL,RL-65  Bajaj Nagar  Veer Savarkar Colony  Bajaj Nagar  Waluj  Wadgaon Kolhati  Maharashtra 431133,AURANGABAD,Aurangabad,Aurangabad,Maharashtra,State,,,C,AURANGABAD CENTRE
MOTHER TERESA ENGLISH SCHOOL,Waluj Aurangabad- 431133,Aurangabad ,Gangapur,Aurangabad,Maharashtra,State,8855883348,,A,AURANGABAD CENTRE
PINAKESHWAR ENGLISH HIGH SCHOOL,SANGHARSHANAGAR  N2 CIDCO AURANAGABAD 431007,Aurangabad,Aurangabad,Aurangabad,Maharashtra,CBSE,9404891256,,A+,AURANGABAD CENTRE
HIMALAYA PUBLIC SCHOOL,Beed Bypass Rd  Arjun Nagar  Chhatrapati Sambhajinagar (Aurangabad)  Maharashtra 431210,AURANGABAD,Aurangabad,Aurangabad,Maharashtra,CBSE,,,A,AURANGABAD CENTRE
SAROSH ENGLISH SCHOOL,Padegaon Aurangabad,Padegaon Aurangabad,Aurangabad,Aurangabad,Maharashtra,State,,,A,AURANGABAD CENTRE
KIDS KIMDOM ENGLISH SCHOOL,40  Sindhi Colony  Mondha Naka  B/h Gurudwara  Aurangabad  Maharashtra 431001 ,Aurangabad ,Aurangabad,Aurangabad,Maharashtra,State,2402326268,,B,AURANGABAD CENTRE
ELLORA ENGLISH,Satara Deolai Parisar  Chhatrapati Sambhajinagar (Aurangabad)  Maharashtra 431007,AURANGABAD,Aurangabad,Aurangabad,Maharashtra,CBSE,,,A,AURANGABAD CENTRE
PINAKESHWAR HIGH SCHOOL,SANGHARSHA NAGAR N2 CIDCO AURANGABAD 431007,Aurangabad,Aurangabad,Aurangabad,Maharashtra,State,9404891256,,A,AURANGABAD CENTRE
DELHI PUBLIC SCHOOL,Shernapur Aurangabad,Shernapur Aurangabad,Aurangabad,Aurangabad,Maharashtra,CBSE,,,A,AURANGABAD CENTRE
SWAMI VIVEKANAND ENGLISH SCHOOL,Shernapur Aurangabad,Shernapur Aurangabad,Aurangabad,Aurangabad,Maharashtra,CBSE,,,A,AURANGABAD CENTRE
MOUNT VALLEY TECHNO SCHOOL,R9WG+H6G  Beed Bypass Rd  Balapur  Chhatrapati Sambhajinagar (Aurangabad)  Maharashtra 431007,AURANGABAD,Aurangabad,Aurangabad,Maharashtra,CBSE,,,A,AURANGABAD CENTRE
ADARSH HIGH SCHOOL,SANGHARSHA NAGAR N2  CIDCO AURANGABAD,Aurangabad,Aurangabad,Aurangabad,Maharashtra,State,9623500644,,B,AURANGABAD CENTRE
GREENFIELD ENGLISH SCHOOL,Bhagya Nagar  Aurangabad  Maharashtra 431001 ,Aurangabad ,Aurangabad,Aurangabad,Maharashtra,State,9044409111,,A,AURANGABAD CENTRE
PARAMAND PUBLIC SCHOOL,Beed Bypass Rd  near Kamalnayan Bajaj hospital  Satara Parisar  Chhatrapati Sambhajinagar (Aurangaba,AURANGABAD,Aurangabad,Aurangabad,Maharashtra,State,,,C,AURANGABAD CENTRE
MGM SANSKAR SCHOOL  WALUJ,Waluj,Waluj,Aurangabad,Aurangabad,Maharashtra,State,,,B,AURANGABAD CENTRE
NARENDRA VIDYA MANDIR,SWAPNA NAGARI  GARKHEDA  AURANGABAD,Aurangabad,Aurangabad,Aurangabad,Maharashtra,State,8080076984,,B,AURANGABAD CENTRE
SMALL WONDERS SCHOOL,Waluj Aurangabad- 431133,Aurangabad ,Aurangabad,Aurangabad,Maharashtra,State,9028010081,,A,AURANGABAD CENTRE
CHATRAPATI HIGH SCHOOL,VIJAY CHOWK  GAJANAN NAGAR GARKHEDA AURANGABAD,Aurangabad,Aurangabad,Aurangabad,Maharashtra,State,7875819514,,B,AURANGABAD CENTRE
GAJANAN HIGHSCHOOL,431133  Shikshak Nagar  Ranjangaon Shenpunji  Waluj  Chhatrapati Sambhajinagar (Aurangabad)  Maharas,AURANGABAD,Aurangabad,Aurangabad,Maharashtra,State,,,B,AURANGABAD CENTRE
BASAWANTRAO PATIL ENGLISH SCHOOL,431133  Shikshak Nagar  Ranjangaon Shenpunji  Waluj  Chhatrapati Sambhajinagar (Aurangabad)  Maharas,AURANGABAD,Aurangabad,Aurangabad,Maharashtra,State,,,A,AURANGABAD CENTRE
JAY BHADRA HIGHSCHOOL,RANJANGAON  WALUJ  AURANGABAD ,AURANGABAD,Aurangabad,Aurangabad,Maharashtra,State,,,C,AURANGABAD CENTRE
MILIND HIGH SCHOOL,CHAWANI AREA AURANGABAD,Aurangabad,Aurangabad,Aurangabad,Maharashtra,State,9422713768,,B,AURANGABAD CENTRE
RAJE SHIVAJI HIGHSCHOOL,R6VV+63Q  Hitech College Rd  Bajaj Nagar  Waluj  Chhatrapati Sambhajinagar (Aurangabad)  Wadgaon Kol,AURANGABAD,Aurangabad,Aurangabad,Maharashtra,State,,,B,AURANGABAD CENTRE
MODERN HIGH SCHOOL,GARKHEDA PARISAR AURANGABAD,Aurangabad,Aurangabad,Aurangabad,Maharashtra,State,8600581113,,B,AURANGABAD CENTRE
UDDHAVRAO PATIL HIGHSCHOOL,Wankhede Nagar  Mahmoodpura  Chhatrapati Sambhajinagar (Aurangabad)  Maharashtra 431003,AURANGABAD,Aurangabad,Aurangabad,Maharashtra,State,,,C,AURANGABAD CENTRE
SANT FRANCIS DE SALES,JALNA ROAD SEVEN HILL  AURANGABAD,Aurangabad,Aurangabad,Aurangabad,Maharashtra,State,7620307915,,B,AURANGABAD CENTRE
Foster Development School ,E/14/11  Shivaji Nagar  Gadia Vihar  Aurangabad  Maharashtra ,Aurangabad ,Aurangabad,Aurangabad,Maharashtra,State,,,B,AURANGABAD CENTRE
APPS ,Gramin Police Mukhyalaya  N 10  Cidco  Chhatrapati Sambhajinagar (Aurangabad)  Maharashtra 431001,AURANGABAD,Aurangabad,Aurangabad,Maharashtra,State,,,A,AURANGABAD CENTRE
Model High School,Navkhanda Jubli park ,Navkhanda Jubli park ,Aurangabad,Aurangabad,Maharashtra,State,,,A,AURANGABAD CENTRE
SONAMATA,L 42/4  L 42/4  N 9  Cidco  Chhatrapati Sambhajinagar (Aurangabad)  Maharashtra 431003,AURANGABAD,Aurangabad,Aurangabad,Maharashtra,State,,,C,AURANGABAD CENTRE
JAI HIND PUBLIC SCHOOL,Shenpunji Ranjangaon -431133,Gangapur ,Gangapur,Aurangabad,Maharashtra,State,,,B,AURANGABAD CENTRE
YCM SCHOOL,Kamlapur raod  Ranjangaon Aurangabad- 431136,Gangapur ,Gangapur,Aurangabad,Maharashtra,State,,,B,AURANGABAD CENTRE
SIDDHIVINAYAK PUBLIC SCHOOL,MIDC Area Waluj Aurangabad,MIDC Area Waluj Aurangabad,Aurangabad,Aurangabad,Maharashtra,State,,,B,AURANGABAD CENTRE
KIDS PRIDE,BEHIND HEDGEWAR HOSPITAL AURANGABAD,Aurangabad,Aurangabad,Aurangabad,Maharashtra,State,9579672696,,B,AURANGABAD CENTRE
DADOJI KONDDEO VIDYALAY,W974+89C  Mhasoba Nagar  Harsul  Chhatrapati Sambhajinagar (Aurangabad)  Maharashtra 431003,AURANGABAD,Aurangabad,Aurangabad,Maharashtra,State,,,C,AURANGABAD CENTRE
NEW HIGH SCHOOL,Dhoregaon -431133,Gangapur ,Gangapur,Aurangabad,Maharashtra,State,8999651300,,B,AURANGABAD CENTRE
Icon International School,Behind Jenci Police Station Near Roshan Gate,Behind Jenci Police Station Near Roshan Gate,Aurangabad,Aurangabad,Maharashtra,State,,,B,AURANGABAD CENTRE
Rayyan International School,Near Jenci Police station Roshan Gate,Near Jenci Police station Roshan Gate,Aurangabad,Aurangabad,Maharashtra,CBSE,,,B,AURANGABAD CENTRE
PARVATI GIRLS HIGHSCHOOL,Hudco Corner  K Sector  Navjivan Colony  N 11  Cidco  Chhatrapati Sambhajinagar (Aurangabad)  Mahara,AURANGABAD,Aurangabad,Aurangabad,Maharashtra,State,,,C,AURANGABAD CENTRE
ST JOSEPH SCHOOL,Gut no Waluj Aurangabad -431136,Aurangabad ,Aurangabad,Aurangabad,Maharashtra,State,,,A,AURANGABAD CENTRE
Rajiv gandhi School,Near Mubarak Masjid Roshan Gate,Near Mubarak Masjid Roshan Gate,Aurangabad,Aurangabad,Maharashtra,State,,,B,AURANGABAD CENTRE
Cute ducklings,18  Shreya Nagar  New Usmanpura  Chhatrapati Sambhajinagar (Aurangabad)  Maharashtra 431001,AURANGABAD,Aurangabad,Aurangabad,Maharashtra,State,,,B,AURANGABAD CENTRE
Spring Dale English School,Near Mubarak Masjid Roshan Gate,Near Mubarak Masjid Roshan Gate,Aurangabad,Aurangabad,Maharashtra,State,,,A,AURANGABAD CENTRE
SAHYADRI SCHOOL,Paithan Road Waluj,Aurangabad ,Aurangabad,Aurangabad,Maharashtra,State,,,A,AURANGABAD CENTRE
Icon english school,V87M+R35  Sahakar Nagar  New Usmanpura  Chhatrapati Sambhajinagar (Aurangabad)  Maharashtra 431001,AURANGABAD,Aurangabad,Aurangabad,Maharashtra,CBSE,,,B,AURANGABAD CENTRE
SUDHAKAR RAO HIGHSCHOOL,Garkheda parisar Aurangabad- 431001,Aurangabad ,Aurangabad,Aurangabad,Maharashtra,State,,,A,AURANGABAD CENTRE
Mushtaq Ahmed School,Near Mubarak Masjid Roshan Gate,Near Mubarak Masjid Roshan Gate,Aurangabad,Aurangabad,Maharashtra,State,,,B,AURANGABAD CENTRE
DANGE SCHOOL,N2 CIDCO  AURANGABAD,Aurangabad,Aurangabad,Aurangabad,Maharashtra,State,9326853770,,A,AURANGABAD CENTRE
Genius Vally CBSC School,V8VX+HFC  Kat Kat Gate Rd  Kat Kat Gate  Farzad Colony  Jaswantpura  Chhatrapati Sambhajinagar (Aura,V8VX+HFC  Kat Kat Gate Rd  Kat Kat Gate  Farzad Colony  Jaswantpura  Chhatrapati Sambhajinagar (Aura,Aurangabad,Aurangabad,Maharashtra,CBSE,,,A,AURANGABAD CENTRE
BURHANI ENGLISH SCHOOL,BEHIND CITY7 CHOWK POLICE STATION AURANGABAD,Aurangabad,Aurangabad,Aurangabad,Maharashtra,State,9028029747,,A,AURANGABAD CENTRE
Almir School,Roshan Gate  Sharif Colony  Jaswantpura  Chhatrapati Sambhajinagar (Aurangabad)  Maharashtra 431003,Roshan Gate  Sharif Colony  Jaswantpura  Chhatrapati Sambhajinagar (Aurangabad)  Maharashtra 431003,Aurangabad,Aurangabad,Maharashtra,State,,,B,AURANGABAD CENTRE
Om highschool,V88M+9WQ  New Shreya Nagar  Sahakar Nagar  New Usmanpura  Chhatrapati Sambhajinagar (Aurangabad)  Ma,AURANGABAD,Aurangabad,Aurangabad,Maharashtra,State,,,B,AURANGABAD CENTRE
RAINBOW HIGH SCHOOL,GUT NO 194 SAWANGI Ashrafpur  Maharashtra 431008 Sawangi by -pass maharashtra  Chhatrapati Sambhajin,GUT NO 194 SAWANGI Ashrafpur  Maharashtra 431008 Sawangi by -pass maharashtra  Chhatrapati Sambhajin,Aurangabad,Aurangabad,Maharashtra,State,,,A,AURANGABAD CENTRE
Anant bhalerao highschool,V8CQ+342  Chetana Nagar  Sindhi Colony  Chhatrapati Sambhajinagar (Aurangabad)  Maharashtra 431001,AURANGABAD,Aurangabad,Aurangabad,Maharashtra,State,,,B,AURANGABAD CENTRE
BSGM SCHOOL, Gurusahani Nagar  Sector N 4  Cidco  Chhatrapati Sambhajinagar (Aurangabad)  Maharashtra 431001,Aurangabad,Aurangabad,Aurangabad,Maharashtra,State,2402991488,,A,AURANGABAD CENTRE
Al Hidaya Public School,Central Naka Rd  Indira Nagar  M G M  Chhatrapati Sambhajinagar (Aurangabad)  Maharashtra 431003,Central Naka Rd  Indira Nagar  M G M  Chhatrapati Sambhajinagar (Aurangabad)  Maharashtra 431003,Aurangabad,Aurangabad,Maharashtra,CBSE,8286522034,,A,AURANGABAD CENTRE
GREENFIELD INTERNATIONAL SCHOOL,Daulatabad T point sharnapur  Maharashtra 431001,AURANGABAD,Aurangabad,Aurangabad,Maharashtra,State,,,A,AURANGABAD CENTRE
Vidhyashri Coaching Classes,Balaji Socitey  Near Maharastra Bank,Yavatmal,Yavatmal,Yavatmal,Maharashtra,State,9822366702,,B,YAVATMAL CENTRE
MAHARASHTRA PUBLIC SCHOOL,W67H+CCW  Daulatabad T Point  Bhangasimata Rd  Wanjarwadi  Maharashtra 431002,AURANGABAD,Aurangabad,Aurangabad,Maharashtra,State,,,A,AURANGABAD CENTRE
GURU TEGH BAHADUR HIGH SCHOOL,MANISH NAGAR BEHIND GURUDWARA AURANGABAD,Aurangabad,Aurangabad,Aurangabad,Maharashtra,State,9096202420,,A,AURANGABAD CENTRE
Yashwantrao chavan highschool,Gatkal Rd  Sambhaji Colony  Mathura Nagar  N-6  Cidco  Chhatrapati Sambhajinagar (Aurangabad)  Mahar,Gatkal Rd  Sambhaji Colony  Mathura Nagar  N-6  Cidco  Chhatrapati Sambhajinagar (Aurangabad)  Mahar,Aurangabad,Aurangabad,Maharashtra,State,,,B,AURANGABAD CENTRE
GURUKUL SCHOOL,Daulatabad T Point  Bhangasimata Rd  Wanjarwadi  Maharashtra 431002,AURANGABAD,Aurangabad,Aurangabad,Maharashtra,State,,,A,AURANGABAD CENTRE
BAL NYAN MANDIR SCHOOL,KHADKESHWAR AURANGABAD,Aurangabad,Aurangabad,Aurangabad,Maharashtra,State,9284847582,,C,AURANGABAD CENTRE
GYANESHWAR HIGH SCHOOL,BEGAMPURA AURANGABAD ,Aurangabad,Aurangabad,Aurangabad,Maharashtra,State,,,B,AURANGABAD CENTRE
IDEAL INTERNATIONAL SCHOOL,tisgaon chowk new bombay highway tisgaon  Waluj  Chhatrapati Sambhajinagar (Aurangabad)  Maharashtra,AURANGABAD,Aurangabad,Aurangabad,Maharashtra,State,,,B,AURANGABAD CENTRE
HOLY CRESENT ENGLISH SCHOOL,Shah Nagar  near Adarsh Laws  Satara Parisar  Chhatrapati Sambhajinagar (Aurangabad)  Maharashtra 43,AURANGABAD,Aurangabad,Aurangabad,Maharashtra,State,,,B,AURANGABAD CENTRE
GAJANAN HIGH SCHOOL,GAJANAN COLONY   GARKHEDA PARISAR AURANGABAD,Aurangabad,Aurangabad,Aurangabad,Maharashtra,State,8956644445,,B,AURANGABAD CENTRE
S.S HIGH SCHOOL,SHIVAJI NAGAR AURANGABAD,Aurangabad,Aurangabad,Aurangabad,Maharashtra,State,2227708854,,A,AURANGABAD CENTRE
Shri Umiya Shankar Narayanji High School,Lakadganj  Queta Colony  Nagpur  Maharashtra 440008,Lakadganj,Nagpur,Nagpur,Maharashtra,State,,,B,EAST CENTRE - NAGPUR
Shahu's Garden High School & Junior College(Manewada),Ulhas Nagar Tkdoji Road Manewada,Manewada Square,Nagpur,Nagpur,Maharashtra,State,9730418851,,A,EAST CENTRE - NAGPUR
Pandit Bachharaj Vyas Vidyalaya English Medium  Medical Square  Nagpur,Near Rajabaksha Mandir Medical Square,Medical Square,Nagpur,Nagpur,Maharashtra,State,7122740767,pbvvkm@gmail.com,A,EAST CENTRE - NAGPUR
Agresen Vidyamandir Aurangabad,Gut No. 35  Lilasons Campus  Paithan Rd  Itkheda  Chhatrapati Sambhajinagar (Aurangabad)  Maharashtr,Gut No. 35  Lilasons Campus  Paithan Rd  Itkheda  Chhatrapati Sambhajinagar (Aurangabad)  Maharashtr,Aurangabad,Aurangabad,Maharashtra,CBSE,8698677477,,A+,AURANGABAD CENTRE
RJ International School,Shiv Krupa Colony  PWD Colony  Chhatrapati Sambhajinagar (Aurangabad)  Maharashtra 431005,Shiv Krupa Colony  PWD Colony  Chhatrapati Sambhajinagar (Aurangabad)  Maharashtra 431005,Aurangabad,Aurangabad,Maharashtra,CBSE,,,A+,AURANGABAD CENTRE
Nath Valley School,Paithan Road  Cantonment Post Office  Chhatrapati Sambhajinagar (Aurangabad)  Maharashtra 431002,Paithan Road  Cantonment Post Office  Chhatrapati Sambhajinagar (Aurangabad)  Maharashtra 431002,Aurangabad,Aurangabad,Maharashtra,State,,,A+,AURANGABAD CENTRE
Moin Ul Uloom High School,beside Moin Ul Uloom School  Silk Mill Colony  Chhatrapati Sambhajinagar (Aurangabad)  Maharashtra 4,beside Moin Ul Uloom School  Silk Mill Colony  Chhatrapati Sambhajinagar (Aurangabad)  Maharashtra 4,Aurangabad,Aurangabad,Maharashtra,State,,,B,AURANGABAD CENTRE
KIDS PRIDE ENGLISH SCHOOL ,Plot No 165 Shashtrinagar  Garkheda  Aurangabad-Maharashtra - 431009 (Behind Hedgewar Hospital  Munc,GARKHEDA PARISAR,Aurangabad,Aurangabad,Maharashtra,State,,,A,AURANGABAD CENTRE
DEVGIRI GLOBAL ACADEMY,Bhagirath Nagar  Station Road  Rachanakar Colony  Padampura  Chhatrapati Sambhajinagar (Aurangabad) ,PADAMPURA,Aurangabad,Aurangabad,Maharashtra,CBSE,7350302222,,A+,AURANGABAD CENTRE
NEW BEGINING INTERNATIONAL SCHOOL,CHOWKA SAWANGI SHIVAR NAIGAON CHARAPATI SAMBHAJINAGAR,SAWANGI,Aurangabad,Aurangabad,Maharashtra,CBSE,7588053266,,A+,AURANGABAD CENTRE
SANKRITI GLOBAL ENGLISH SCHOOL ,JALGAON ROAD SAWANGI,SAWANGI,Aurangabad,Aurangabad,Maharashtra,State,9921917884,,A,AURANGABAD CENTRE
KIDS VALLEY ENGLISH SCHOOL ,BHAGATSING NAGAR HARSUL,HARSUL,Aurangabad,Aurangabad,Maharashtra,State,,,A,AURANGABAD CENTRE
