St Mary's English school Pusad ,Pusad ,Pusad ,Pusad,Yavatmal,Maharashtra,CBSE,,,A,RESIDENTIAL CENTRE
Dr. Yardy English high school ,Pandharkawada ,Pandharwada ,Pandharkwada,Yavatmal,Maharashtra,State,,,A,RESIDENTIAL CENTRE
Rajarshri Shahu school ,Pandharkawada ,Pandharkawada ,Pandharkwada,Yavatmal,Maharashtra,State,,,B,RESIDENTIAL CENTRE
New  English medium school ,Pandharkawada ,Pandharkawada ,Pandharkwada,Yavatmal,Maharashtra,State,,,B,RESIDENTIAL CENTRE
Krishak English School,Arvi,Arvi,Arvi,Wardha,Maharashtra,State,,,A,RESIDENTIAL CENTRE
Krishak High School,Arvi,Arvi,Arvi,Wardha,Maharashtra,State,,,B,RESIDENTIAL CENTRE
Sainik public school ,Wadki  Pandharkawada ,Pandharkawada ,Pandharkwada,Yavatmal,Maharashtra,State,,,B,RESIDENTIAL CENTRE
Gurukul English medium school  Mouda  Nagpur ,Pandharkawada ,Pandharkawada ,Pandharkwada,Yavatmal,Maharashtra,CBSE,,,B,RESIDENTIAL CENTRE
Gandhi City Public School,wardha,Wardha,Wardha,Wardha,Maharashtra,CBSE,,,A,RESIDENTIAL CENTRE
St. Gianelli Convent School  Kamptee,Ajani  Gumthala  Road  Th:  Kamptee  Maharashtra 441002,Gumthala,Kamptee,Nagpur,Maharashtra,CBSE,9420025795,St.gianelliconventschool@gmail.com,A,SADAR CENTRE- NAGPUR
demo,demo,demo,Yavatmal,Yavatmal,Maharashtra,ICSE,9096300320,demo123@gmail.com,A,YAVATMAL CENTRE
Aspire international SCHOOL, Survey no 56/3  Plot no-73  Khasarmari Off NH7  Wardha road  Nagpur  Maharashtra 441108,Wardha road,Nagpur,Nagpur,Maharashtra,ICSE,,,B,HEAD OFFICE -NAGPUR
Podar International School,Dhamangaon - Nagpur bypass road,Yavatmal,Yavatmal,Yavatmal,Maharashtra,CBSE,7506645821,principal.yavatmal@podar.org,A,YAVATMAL CENTRE
Jawaharlal Darda convent CBSE,Godhani Rd  Chapman Wadi,Yavatmal,Yavatmal,Yavatmal,Maharashtra,CBSE,,jdemsytl@gmail.com,A,YAVATMAL CENTRE
Jawaharlal Darda School  Yavatmal,Godhani Rd  Chapman Wadi,Yavatmal,Yavatmal,Yavatmal,Maharashtra,CBSE,,jdemsytl@gmail.com,A,YAVATMAL CENTRE
Shahu's Garden High School & Junior College(Manewada),Ulhas Nagar Tkdoji Road Manewada,shahu nagar,Nagpur,Nagpur,Maharashtra,State,9730418851,,A,EAST CENTRE - NAGPUR
Elegant IF  English School,Ner,Ner,Yavatmal,Yavatmal,Maharashtra,State,,,B,RESIDENTIAL CENTRE
Shree Radhe Convent,Manewada Rd  New Dnyaneshwar Nagar  Balaji Nagar  Ayodhya nagar  Nagpur  Maharashtra 440024,manewada,Nagpur,Nagpur,Maharashtra,State,,,B,EAST CENTRE - NAGPUR
Giants English Medium School,Arni Road,Yavatmal,Yavatmal,Yavatmal,Maharashtra,State,9673017803,,A,YAVATMAL CENTRE
Shri Satya Sai English Medium School  Yavatmal,Yavatmal,Yavatmal,Yavatmal,Yavatmal,Maharashtra,State,7020456325,,C,YAVATMAL CENTRE
Nandurkar School. Yavatmal,Yavatmal,Yavatmal,Yavatmal,Yavatmal,Maharashtra,State,,,C,RESIDENTIAL CENTRE
DR NANDURKAR VIDYALAYA YAVATMAL,Yavatmal,Yavatmal,Yavatmal,Yavatmal,Maharashtra,State,,,C,RESIDENTIAL CENTRE
Shri Datta Vidya Mandir,P - 16  MIDC  Butibori  Nagpur  Maharashtra ,Butibori,Nagpur,Nagpur,Maharashtra,CBSE,7000509428,sdvmbtbcbse@gmail.com,B,HEAD OFFICE -NAGPUR
School of Scholars,Hudkeshwar,Hudkeshwar,Nagpur,Nagpur,Maharashtra,CBSE,,,A,EAST CENTRE - NAGPUR
School of Scholars,Hudkeshwar,Hudkeshwar,Nagpur,Nagpur,Maharashtra,CBSE,,,A,EAST CENTRE - NAGPUR
Megha Coaching Classes,Yavatmal,Yavatmal,Yavatmal,Yavatmal,Maharashtra,State,,,B,RESIDENTIAL CENTRE
P1 Coaching Classes,Jawahar Nagar,Jawahar Nagar,Bhandara,Bhandara,Maharashtra,CBSE,7507508265,plcoachingclasses@gmail.com,A,RESIDENTIAL CENTRE
Science Institute (Urade Sir), Bhandara,bhandara,Bhandara,Bhandara,Maharashtra,CBSE,,,A,RESIDENTIAL CENTRE
Sarang Class,Bhandara,bhandara,Bhandara,Bhandara,Maharashtra,CBSE,,,A+,RESIDENTIAL CENTRE
Chanakya School of Intelligence ,Wardha,Wardha,Wardha,Wardha,Maharashtra,State,,,A,RESIDENTIAL CENTRE
Chanawar 'e' vidya mandir school,Wardha,Arvi road,Wardha,Wardha,Maharashtra,CBSE,9175821590,,A,RESIDENTIAL CENTRE
Deshpande Classes,Wardha,Sai Nagar,Wardha,Wardha,Maharashtra,CBSE,7709695067,,A,RESIDENTIAL CENTRE
Chandurkar Classes,Sai Nagar  Wardha,Sai Nagar,Wardha,Wardha,Maharashtra,State,9975954993,,A,RESIDENTIAL CENTRE
St. Vincent Palloti School  Ranala,Ranala Old Kamptee Road,Old Kamptee Road,Nagpur,Nagpur,Maharashtra,CBSE,8956077940,svpsngpk@gmail.com,B,SADAR CENTRE- NAGPUR
NEW ERA ENGLISH SCHOOL ,BHAGWAN NAGAR   NAGPUR ,manewada,Nagpur,Nagpur,Maharashtra,State,9049860421,,C,EAST CENTRE - NAGPUR
RTC Tuition Classes,Sonar Gali Khaperkheda,Khaperkheda,Nagpur,Nagpur,Maharashtra,CBSE,7972146007,,A+,SADAR CENTRE- NAGPUR
Harikisan Maloo International School,Shegaon - Rahatgaon Rd  opp. Deshmukh Lawns  Arjun Nagar  Amravati  Maharashtra 444603,Arjun nagar,AMRAVATI,AMRAVATI,Maharashtra,CBSE,,,A,AMRAVATI CENTRE
st. francis de sales school  badnera,SFS SQUARE  NEW TOWN  Badnera,Badnera,AMRAVATI,AMRAVATI,Maharashtra,CBSE,,,A,AMRAVATI CENTRE
Tittan Public Schoo;,Near Ram Meghe Engg. Collage anjanggaobari road Amravati,Badnera,AMRAVATI,AMRAVATI,Maharashtra,CBSE,,,A,AMRAVATI CENTRE
Rainbow Convent,Hudkeshwar,Rajapeth  Nagpur,Nagpur,Nagpur,Maharashtra,State,9373402382,,D,EAST CENTRE - NAGPUR
Gajanan Vidyalaya,Uday Nagar rd,NIT garden  Nagpur,Nagpur,Nagpur,Maharashtra,State,,,D,EAST CENTRE - NAGPUR
Swami Awdheshand School,Nandanwan,Nagpur,Nagpur,Nagpur,Maharashtra,CBSE,,,C,EAST CENTRE - NAGPUR
st Rosello Convent,mauda,mauda,Mouda,Bhandara,Maharashtra,CBSE,,,A+,RESIDENTIAL CENTRE
Narayana Public School,Nibhora Khurd behind SOS amravati ,Badnera,AMRAVATI,AMRAVATI,Maharashtra,CBSE,,,A+,AMRAVATI CENTRE
Delhi Public School,Near Gopal Kirana store Income tax office ,Amravati,AMRAVATI,AMRAVATI,Maharashtra,CBSE,,,A+,AMRAVATI CENTRE
Edify English School ,Kathora Road   Kathora Amravati ,Amravati,AMRAVATI,AMRAVATI,Maharashtra,CBSE,,,A+,AMRAVATI CENTRE
Gaurav Sir ,Near Walni By Pass Road,Khaperkheda,Nagpur,Nagpur,Maharashtra,CBSE,9822369411,,A,SADAR CENTRE- NAGPUR
K.K. Cambridge  School,Mardi Road Amravati ,Amravati,AMRAVATI,AMRAVATI,Maharashtra,CBSE,,,A+,AMRAVATI CENTRE
ZILLA PARISHAD HS,LAKHANDUR,LAKHANDUR,Bhandara,Bhandara,Maharashtra,State,,,B,RESIDENTIAL CENTRE
DR BABASAHEB AMBEDKAR SCHOOL,LAKHANDUR,LAKHANDUR,Bhandara,Bhandara,Maharashtra,State,,,B,RESIDENTIAL CENTRE
Manikgarh cement English school,Gadchandur,gadchandur,Gadchandur,Chandrapur,Maharashtra,CBSE,,,A,CHANDRAPUR CENTRE
Pravin Sir (Ballarshah),Ballarshah,Ballarshah,Ballarpur,Chandrapur,Maharashtra,CBSE,,,A,CHANDRAPUR CENTRE
Gupta Sir (Ballarshah),Ballarshah,Ballarshah,Ballarpur,Chandrapur,Maharashtra,CBSE,,,A+,CHANDRAPUR CENTRE
Rao Sir (Ballarsha),Ballarshah,Ballarshah,Ballarpur,Chandrapur,Maharashtra,CBSE,,,A,CHANDRAPUR CENTRE
Aditya Birla Public School (Awarpur),Awarpur,Awarpur,Gadchandur,Chandrapur,Maharashtra,CBSE,,,B,CHANDRAPUR CENTRE
SMD Bharti High School,Arni,Arni,Arni,Yavatmal,Maharashtra,State,9763794848,smdbarni.hm@gmail.com,C,YAVATMAL CENTRE
C. G. WANJARI HIGH SCHOOL,NEAR NASRE MANGAL KARYALAYA   HUDKEHSWAR ROAQD NAGPUR ,HUDKESHWAR,Nagpur,Nagpur,Maharashtra,State,,,C,EAST CENTRE - NAGPUR
ST. ANTHONY'S HIGH SCHOOL ,AJNI ROAD  NAGPUR ,AJNI,Nagpur,Nagpur,Maharashtra,State,,,C,EAST CENTRE - NAGPUR
Vijaya Convent,Adarsh Nagar  Anchal Vihar  Akoli Rd  behind Parvati Nagar  Amravati  444607, Akoli Road Parvati Nagar,AMRAVATI,AMRAVATI,Maharashtra,CBSE,7378661801,,A,AMRAVATI CENTRE
Jack And Jill Public School,Prashant Nagar  Shyam Nagar  Amravati,Prashant Nagar  Shyam Nagar,AMRAVATI,AMRAVATI,Maharashtra,State,,,B,AMRAVATI CENTRE
Aurbindo Classes,Near University Mardi Road  Amravati,Mardi road,AMRAVATI,AMRAVATI,Maharashtra,State,9421626262,,A,AMRAVATI CENTRE
Yashoda Classes,Near University Mardi Road  Amravati,Mardi road,AMRAVATI,AMRAVATI,Maharashtra,State,,,A,AMRAVATI CENTRE
Ratnesh Sir Classes,Ashok Nagar Near Tirpude Hospital,Kamptee Road,Nagpur,Nagpur,Maharashtra,CBSE,7276779775,,A+,SADAR CENTRE- NAGPUR
St. Michael's CBSE ,Ram Nagar  Chandrapur,Ram Nagar,Chandrapur,Chandrapur,Maharashtra,CBSE,9960011477,,A,CHANDRAPUR CENTRE
Carmel Academy ICSE,Datala Rd  Chandrapur  Maharashtra,Datala Road,Chandrapur,Chandrapur,Maharashtra,ICSE,9028690289,,A,CHANDRAPUR CENTRE
School Of Scholars Amravati,Mouza Nimbora khurd  Badnera Rd  near gopal nagar road  near Sipna Engineering college  Amravati  ,Gopal nagar road,AMRAVATI,AMRAVATI,Maharashtra,CBSE,,,A+,AMRAVATI CENTRE
Akshara Tution,Near Sakshra Paradise Englsih School  kaloti nagar  old bypass road,old bypass road,AMRAVATI,AMRAVATI,Maharashtra,State,9284855372,,C,AMRAVATI CENTRE
Paradise English Medium School,Armori,Armori,Gadchiroli,Gadchiroli,Maharashtra,State,,,B,RESIDENTIAL CENTRE
Vidyaniketan School  Bramhapuri,Bramhapuri,Bramhapuri,Chandrapur,Chandrapur,Maharashtra,CBSE,,,A,CHANDRAPUR CENTRE
shivaji H.S: GADCHANDUR,Gadchandur,gadchandur,Gadchandur,Chandrapur,Maharashtra,State,,,B,CHANDRAPUR CENTRE
Prithvi Sir  Bramhapuri,Bramhapuri,Bramhapuri,Chandrapur,Chandrapur,Maharashtra,CBSE,,,A,CHANDRAPUR CENTRE
BAJAJ VIDYA MANDIR BALLARSHA RD,BABULPETH CHANDRAPUR, BABULPETH CHANDRAPUR,Chandrapur,Chandrapur,Maharashtra,CBSE,,,A,CHANDRAPUR CENTRE
SaiBaba  High School ,Behind Saibaba Mandir Amravati,Amravati,AMRAVATI,AMRAVATI,Maharashtra,State,,,B,AMRAVATI CENTRE
Sarswati High School ,Bypass road Amravati ,Amravati,AMRAVATI,AMRAVATI,Maharashtra,State,,,C,AMRAVATI CENTRE
St. Roben Public School,misal layout  jaripatka  nagpur thaware colony,Jaripatka,Nagpur,Nagpur,Maharashtra,CBSE,9373714109,,C,SADAR CENTRE- NAGPUR
Scholar Academy,15  shikshak colony  near lic colony amravati,shikshak colony  near lic colony ,AMRAVATI,AMRAVATI,Maharashtra,CBSE,9011199796,,B,AMRAVATI CENTRE
Lotus English School,Congress Nagar  Amravati,Congress Nagar,AMRAVATI,AMRAVATI,Maharashtra,State,,,C,AMRAVATI CENTRE
Kadam Sir  Classes,Congress Nagar Rd  near Kasturba Kanya School,Congress Nagar Rd,AMRAVATI,AMRAVATI,Maharashtra,State,,,B,AMRAVATI CENTRE
Pratik Sir Classes,CMPDI Road Jaripatka,Jaripatka,Nagpur,Nagpur,Maharashtra,State,7385026718,,B,SADAR CENTRE- NAGPUR
AWASTHY COACHING CLASSES,TUMSAR,TUMSAR,Pauni,Bhandara,Maharashtra,CBSE,,,A,RESIDENTIAL CENTRE
St. Tajuddin Convent School & Junior College,Umred Rd  Beside Shri Vittal Rao Ji Chamat Sanstha Shaishmik  Mauja Kharbi  Dighori Naka  Dighori  N,Dighori,Nagpur,Nagpur,Maharashtra,State,,,C,EAST CENTRE - NAGPUR
St. Anne's school  Warora,Warora,Warora,Warora,Chandrapur,Maharashtra,State,,,A,CHANDRAPUR CENTRE
Delhi Public School [D.P.S] ,DPS  49/2  Kranti Colony Rd  Saturna  Amravati  Maharashtra 444607,Amravati,AMRAVATI,AMRAVATI,Maharashtra,State,,,A+,AMRAVATI CENTRE
Shashvat Concept School,Shegaon - Rahatgaon Rd  Rahatgaon  Amravati,Shegaon - Rahatgaon Rd,AMRAVATI,AMRAVATI,Maharashtra,ICSE,,,A+,AMRAVATI CENTRE
Manosuman Public school,Paoni,Pauni,Pauni,Bhandara,Maharashtra,CBSE,,,A,RESIDENTIAL CENTRE
Pund Sir Tution Classess,Krishnarpan Colony  Sharda Vihar  Amravati,Krinsnarpan colony,AMRAVATI,AMRAVATI,Maharashtra,State,,,B,AMRAVATI CENTRE
Shivaji High School  Gadchiroli,Gadchiroli,Gadchiroli,Gadchiroli,Gadchiroli,Maharashtra,State,,,B,RESIDENTIAL CENTRE
Arvind Indo School  Katol,Katol,Katol,Nagpur,Nagpur,Maharashtra,State,,,B,RESIDENTIAL CENTRE
Sonal Agrawal Classes,Gondia,Gondia,Gondia,Gondia,Maharashtra,CBSE,,,A,RESIDENTIAL CENTRE
S.Chandra High School,Gondia,Sadak Arjuni,Gondia,Gondia,Maharashtra,CBSE,,,A,RESIDENTIAL CENTRE
Gour Sir Classes,Gondia,Gondia,Gondia,Gondia,Maharashtra,CBSE,,,A+,RESIDENTIAL CENTRE
New Sita Public School,Deori,Deori,Gondia,Gondia,Maharashtra,CBSE,,,A,RESIDENTIAL CENTRE
Sai Classes (Mr. Varun Agrawal),Aamgaon,Aamgaon,Amgaon,Gondia,Maharashtra,CBSE,,,A,RESIDENTIAL CENTRE
Riya Coachong Classes  Gondia,Gondia,Gondia,Gondia,Gondia,Maharashtra,CBSE,,,A,RESIDENTIAL CENTRE
Gupta Mam Classes  Gondia,Gondia,Gondia,Gondia,Gondia,Maharashtra,State,,,A,RESIDENTIAL CENTRE
Ekvira Public School Morshi,Morshi Chandur railway road Amravati,Morshi,MORSHI,AMRAVATI,Maharashtra,State,,,A,AMRAVATI CENTRE
Mavande Sir Classes Daryapur,Daryapur Amravati,Daryapur Amravati,AMRAVATI,AMRAVATI,Maharashtra,State,,,A+,AMRAVATI CENTRE
Sangahai Boys English school Anjangaosurji ,Anjangaosurji ,Anjangaosurji ,AMRAVATI,AMRAVATI,Maharashtra,State,,,A,AMRAVATI CENTRE
Sangahai Girls English School Anjangaosurji,Anjangaosurji ,Anjangaosurji,AMRAVATI,AMRAVATI,Maharashtra,State,,,A,AMRAVATI CENTRE
SANSKAR INTERNATIONAL SCHOOL Paratwada,Amt. Road Partwada,Paratwada,ANJANGAON SURJI,AMRAVATI,Maharashtra,State,,,A,AMRAVATI CENTRE
Nagar Parishad Chandur Railway,Chandur Railway,Chandur Railway,CHANDUR RAILWAY,AMRAVATI,Maharashtra,State,,,C,AMRAVATI CENTRE
Achievers classes,Dastur nagar  motinagar road,Dastur nagar  motinagar road,AMRAVATI,AMRAVATI,Maharashtra,State,,,A,AMRAVATI CENTRE
CBSE Home Classes,Ganesh nagar near shankar nagar road,Ganesh nagar near shankar nagar road,AMRAVATI,AMRAVATI,Maharashtra,CBSE,,,A,AMRAVATI CENTRE
Zambani Madams Classes,Motinagar  rukmini nagar road  Amravati,Motinagar,AMRAVATI,AMRAVATI,Maharashtra,State,,,A,AMRAVATI CENTRE
Om Vidyaniketan School,Umrer,Umrer,Umred,Nagpur,Maharashtra,CBSE,,,A,RESIDENTIAL CENTRE
Sanskar Vidya Sagar,Umrer,Umrer,Umred,Nagpur,Maharashtra,CBSE,,,A,RESIDENTIAL CENTRE
Vidyaniketan English Medium School  Bhiwapur,Bhiwapur,Bhiwapur,Nagpur,Nagpur,Maharashtra,State,,,A,RESIDENTIAL CENTRE
Jeevan Vikas Vidyalaya,Umrer,Umrer,Umred,Nagpur,Maharashtra,State,,,B,RESIDENTIAL CENTRE
ADARSH SANSKAR VIDYALAYA (CBSE)HUDKESHWAR,PIPLAFATA HUDKESHWAR NAGPUR,HUDKESHWAR,Nagpur,Nagpur,Maharashtra,CBSE,,,B,EAST CENTRE - NAGPUR
Podar International School  Katol Road,Near Asaram Bapu Ashram  Fetri  Katol Road  Nagpur  Maharashtra,Katol Road,Nagpur,Nagpur,Maharashtra,CBSE,7506319232,,A,SADAR CENTRE- NAGPUR
Demo Abhishek,demo address,Demo,Bhandara,Bhandara,Maharashtra,State,9096300320,abhishekahhi@gmail.com,A+,CHANDRAPUR CENTRE
School of Scholars  Wardha,Wardha,Sawangi (Meghe),Wardha,Wardha,Maharashtra,CBSE,,,A+,RESIDENTIAL CENTRE
Jagyasi Coaching Classes, Wardha,Ram Nagar,Wardha,Wardha,Maharashtra,CBSE,,,A,RESIDENTIAL CENTRE
St. Xaviers Cathedral School,Bishop's House Campus  Camp Road  near Dnyanmata school  Amravati,Amravati,AMRAVATI,AMRAVATI,Maharashtra,CBSE,,,A+,AMRAVATI CENTRE
Sevasadan Saksham School,N A Road  Sitabuldi  Nagpur,Nagpur,Nagpur,Nagpur,Maharashtra,CBSE,9822566996,,A,HEAD OFFICE -NAGPUR
Maloo International School ,Near Deshmukh Lawn Shegao naka road amravati ,Amravati,AMRAVATI,AMRAVATI,Maharashtra,CBSE,,,B,AMRAVATI CENTRE
Orchid City International School  Amravati,Navsari  To  Amravati Walgaon Road  Navsari  Amravati,Amravati,AMRAVATI,AMRAVATI,Maharashtra,CBSE,,,A+,AMRAVATI CENTRE
Shashvat Concept School,Shegaon - Rahatgaon Rd  Rahatgaon  Amravati,Amravati,AMRAVATI,AMRAVATI,Maharashtra,CBSE,,,A+,AMRAVATI CENTRE
Nagpur Public School  Teka Naka  Nagpur,786  Kamptee Rd  Near P.W.. College  Old Teka Naka  Teka Naka  Nagpur  Maharashtra 440026,Take Naka,Nagpur,Nagpur,Maharashtra,CBSE,7820939313,,B,SADAR CENTRE- NAGPUR
Orchids The International School - Koradi Road Nagpur,Bokhara Road Railway Crossing  Koradi Rd  Nagpur  Maharashtra 440023,Bokhara,Nagpur,Nagpur,Maharashtra,CBSE,8888888999,,A,SADAR CENTRE- NAGPUR
Podar International School  chandrapur,C. R. Puglia Nagar  Roshan Bagh  Datala Rd  Chandrapur ,chandrapur,Chandrapur,Chandrapur,Maharashtra,CBSE,8291924941,,A,CHANDRAPUR CENTRE
Vidya Vihar Convent High School  chandrapur,Biyani Nagar  Tukum  Chandrapur ,chandrapur,Chandrapur,Chandrapur,Maharashtra,State,9423623823,,A,CHANDRAPUR CENTRE
Mount litra zee  school chandrapur,Datala road  ramanagar  chandrapur,chandrapur,Chandrapur,Chandrapur,Maharashtra,CBSE,,,A,CHANDRAPUR CENTRE
Rajarshee Shahu English School  Chandur Railway,chandur railway,chandur railway,CHANDUR RAILWAY,AMRAVATI,Maharashtra,State,,,A,AMRAVATI CENTRE
Z P Madhyamik Vidyalaya Chandur Railway ,chandur railway,chandur railway,CHANDUR RAILWAY,AMRAVATI,Maharashtra,State,,,B,AMRAVATI CENTRE
Raje Madam,Bhandatra,Bhandara,Bhandara,Bhandara,Maharashtra,CBSE,,,A+,RESIDENTIAL CENTRE
School Of Brillants ,Ralegaon ,Ralegaon ,Yavatmal,Yavatmal,Maharashtra,CBSE,,,A,RESIDENTIAL CENTRE
R.M. International School,Ralegaon ,Ralegaon ,Yavatmal,Yavatmal,Maharashtra,CBSE,,,A+,RESIDENTIAL CENTRE
Vidya Niketan dadawadi CBSE  Chandrapur,highway  SH 264  Chandrapur - Nagpur Rd  Wadgaon  Chandrapur  ,chandrapur,Chandrapur,Chandrapur,Maharashtra,CBSE,9420300952,,A,CHANDRAPUR CENTRE
Sainik Public School  Wadki,Wadki,Wadki,Yavatmal,Yavatmal,Maharashtra,CBSE,9623317699,,A,RESIDENTIAL CENTRE
Pandharkawada Public School,Pandharkawada,Pandharkawada,Pandharkwada,Yavatmal,Maharashtra,State,,,B,RESIDENTIAL CENTRE
Vivek Jyoti Gyan Peeth Convent  Balaghat,Balaghat,Balaghat,Balaghat,Balaghat,Madhya Pradesh,CBSE,,,A,RESIDENTIAL CENTRE
Sainik Public School,Wadki,Wadki,Yavatmal,Yavatmal,Maharashtra,CBSE,,,A,RESIDENTIAL CENTRE
Mount Litera Zee School,Balaghat,Balaghat Road,Balaghat,Balaghat,Madhya Pradesh,CBSE,,,A,RESIDENTIAL CENTRE
SPM High School Ghatanji,Ghatanji,Ghatanji,Yavatmal,Yavatmal,Maharashtra,State,,,B,RESIDENTIAL CENTRE
Kendriya Vidyalaya Yavatmal ,Yavatmal ,Yavatmal ,Yavatmal,Yavatmal,Maharashtra,CBSE,,,A+,RESIDENTIAL CENTRE
J.C High School ,Karanja Lad,Karanja Lad,Yavatmal,Yavatmal,Maharashtra,State,,,A,RESIDENTIAL CENTRE
Vidyarambh School,Karanja Lad,Karanja Lad,Yavatmal,Yavatmal,Maharashtra,CBSE,,,A+,RESIDENTIAL CENTRE
Blue Chip Convent ,Karanja Lad,Karanja Lad,Yavatmal,Yavatmal,Maharashtra,State,,,A,RESIDENTIAL CENTRE
Vedant Public School,Karanja Lad,Karanja Lad,Yavatmal,Yavatmal,Maharashtra,State,9767662179,,B,RESIDENTIAL CENTRE
Happy Faces The Concept School,Washim ,washim ,Yavatmal,Yavatmal,Maharashtra,State,,,A+,RESIDENTIAL CENTRE
Blossom School  CBSE  Kalamna  Nagpur,Bharatwada Road  Behind of Kalamna Market  Nagpur - 440035.,Kalamna,Kamptee,Nagpur,Maharashtra,CBSE,9373213830,,B,SADAR CENTRE- NAGPUR
Jajoo English Medium School ,Yavatmal ,Yavatmal ,Yavatmal,Yavatmal,Maharashtra,CBSE,,,A+,RESIDENTIAL CENTRE
Gawande Classes ,Washim ,washim ,Yavatmal,Yavatmal,Maharashtra,State,,,A,RESIDENTIAL CENTRE
Octopus Science Academy ,Washim ,washim ,Yavatmal,Yavatmal,Maharashtra,State,,,A,RESIDENTIAL CENTRE
Vidyabharti English Medium School,Digras,Yavatmal ,Yavatmal,Yavatmal,Maharashtra,State,,,A,RESIDENTIAL CENTRE
Wings Academy,Bramhapuri ,Bramhapuri ,Bramhapuri,Bramhapuri,Maharashtra,CBSE,,,A,RESIDENTIAL CENTRE
The Achievers School, Waroda Village  Outer Ring Road  Nagpur  Maharashtra 441108,Waroda   Wardha road   Nagpur,Nagpur,Nagpur,Maharashtra,CBSE,,,B,CHATRAPATI SQUARE CENTRE
Asim Saraf central academy ,Tirora,Tirora,Gondia,Gondia,Maharashtra,CBSE,,,A,RESIDENTIAL CENTRE
St. Joseph High School  Jaitala  Nagpur,Inside Fatima Church  Jaitala  Nagpur,Jaitala,Nagpur,Nagpur,Maharashtra,State,9730266190,,B,HEAD OFFICE -NAGPUR
Good Shephered english School,Seloo,Seloo,Wardha,Wardha,Maharashtra,State,,,B,RESIDENTIAL CENTRE
Arvind indo public school  Narkhed,Narkhed,Narkhed,Nagpur,Nagpur,Maharashtra,State,,,A,RESIDENTIAL CENTRE
Orange City School,Narkhed,Narkhed,Nagpur,Nagpur,Maharashtra,State,,,A,RESIDENTIAL CENTRE
Evergreen Convent School  Narkhed,Narkhed,Narkhed,Nagpur,Nagpur,Maharashtra,State,,,B,RESIDENTIAL CENTRE
Gurudev International Public School  Balaghat,WARSEONI BALAGHAT,Balaghat,Balaghat,Balaghat,Madhya Pradesh,CBSE,,,A+,RESIDENTIAL CENTRE
Tagore Montessori english School  Balaghat,Balaghat,Balaghat,Balaghat,Balaghat,Madhya Pradesh,State,,,A,RESIDENTIAL CENTRE
St Marry  Balaghat,Balaghat,Balaghat,Balaghat,Balaghat,Madhya Pradesh,CBSE,,,A,RESIDENTIAL CENTRE
Air Force School,Vayusena Nagar  Nagpur,Vayusena Nagar,Nagpur,Nagpur,Maharashtra,CBSE,,,A,HEAD OFFICE -NAGPUR
ERA English school,Pandarkauda,Pandarkauda,Pandharkwada,Yavatmal,Maharashtra,CBSE,,,A+,RESIDENTIAL CENTRE
Gurukul public school,Pandarkauda,Pandarkauda,Pandharkwada,Yavatmal,Maharashtra,CBSE,,,A+,RESIDENTIAL CENTRE
Dr.Yardy school,Pandarkauda,Pandarkauda,Pandharkwada,Yavatmal,Maharashtra,CBSE,,,A+,RESIDENTIAL CENTRE
Gurukul public school,Pandarkauda,Pandarkauda,Pandharkwada,Yavatmal,Maharashtra,CBSE,,,A+,RESIDENTIAL CENTRE
SPM convent,Arni,Arni,Arni,Yavatmal,Maharashtra,State,,,A,RESIDENTIAL CENTRE
The world school,Washim,Washim,Washim,Akola,Maharashtra,CBSE,,,A,RESIDENTIAL CENTRE
Sun Rise school,Risod,Rwashim,Washim,Akola,Maharashtra,CBSE,,,A+,RESIDENTIAL CENTRE
Podar school,Risod,Risod,Washim,Akola,Maharashtra,CBSE,,,A+,RESIDENTIAL CENTRE
Ganga Maa vidya mandir,Risod,Risod,Washim,Akola,Maharashtra,State,,,A,RESIDENTIAL CENTRE
Fairyland  School  Bhadrwadi  chandrapur,Gaurala  Bhadravati  Maharashtra 442902,chandrapur,Chandrapur,Chandrapur,Maharashtra,CBSE,,,A,CHANDRAPUR CENTRE
JC High school  Karanja Lad,Karanja lad,Karanja lad,Yavatmal,Yavatmal,Maharashtra,State,,,A,RESIDENTIAL CENTRE
JC convent school  Karanja Lad,Karanja lad,Karanja lad,Yavatmal,Yavatmal,Maharashtra,State,,,A,RESIDENTIAL CENTRE
Vidhyarambh school,Karanja lad,Karanja lad,Yavatmal,Yavatmal,Maharashtra,State,,,A,RESIDENTIAL CENTRE
Vidhyarambh school,Karanja lad,Karanja lad,Yavatmal,Yavatmal,Maharashtra,State,,,A,RESIDENTIAL CENTRE
Vidhyarambh school,Karanja lad,Karanja lad,Yavatmal,Yavatmal,Maharashtra,State,,,A,RESIDENTIAL CENTRE
JD chawre high school,Karanja lad,Karanja lad,Yavatmal,Yavatmal,Maharashtra,State,,,A,RESIDENTIAL CENTRE
JD chawre high school,Karanja lad,Karanja lad,Yavatmal,Yavatmal,Maharashtra,State,,,A,RESIDENTIAL CENTRE
Kankubai High school,Karanja lad,Karanja lad,Yavatmal,Yavatmal,Maharashtra,State,,,A,RESIDENTIAL CENTRE
Takkamore Science Academy ,Ramtek ,Ramtek ,Nagpur,Nagpur,Maharashtra,State,9595157311,,A,RESIDENTIAL CENTRE
Plus Point Academy ,Mansar,Mansar ,Nagpur,Nagpur,Maharashtra,State,9373981383,,A,RESIDENTIAL CENTRE
Dnyandeep Convent Ramtek ,Ramtek ,Ramtek ,Nagpur,Nagpur,Maharashtra,State,,,A,RESIDENTIAL CENTRE
Banarasidas Ruiya High School,Katol,Katol,Katol,Nagpur,Maharashtra,CBSE,,,A+,RESIDENTIAL CENTRE
Riverdale World School,Gondia,Balaghat Road,Gondia,Gondia,Maharashtra,CBSE,9852640597,,A,RESIDENTIAL CENTRE
Shree Swami Vivekanand School,Aamgaon,Amgaon,Amgaon,Gondia,Maharashtra,CBSE,,,A+,RESIDENTIAL CENTRE
Sanskar High School  Gondia,Gondia,Gondia,Gondia,Gondia,Maharashtra,State,,,B,RESIDENTIAL CENTRE
Star International School,Gondia,Gondia,Gondia,Gondia,Maharashtra,CBSE,,,A+,RESIDENTIAL CENTRE
Narayana Vidyalayam,Bokhara Road Railway Crossing  Koradi Rd  Nagpur  Maharashtra 440023,Bokhara,Nagpur,Nagpur,Maharashtra,CBSE,7066032541,nvkoradiroad@nesv.com,A+,SADAR CENTRE- NAGPUR
Mount Carmel convent  ghugus,Ghugus,Ghugus,Chandrapur,Chandrapur,Maharashtra,CBSE,,,A,CHANDRAPUR CENTRE
Regent High School  Hingna ,Hingna Rd  Opposite Sutgirni  Mahajan Wadi  Hingna  Nagpur  Maharashtra 441110,Hingna ,Nagpur,Nagpur,Maharashtra,State,9158773661,,C,HEAD OFFICE -NAGPUR
Rahi Public School  Jaitala  Nagpur,Zade lay out Jaitala Road Jaitala  Nagpur   Maharashtra 440036,Jaitala,Nagpur,Nagpur,Maharashtra,State,,,C,HEAD OFFICE -NAGPUR
Shangrila English School  Sangam  Hingna  Nagpur,Sangam  Hingna  Nagpur,Hingna,Nagpur,Nagpur,Maharashtra,State,,,C,HEAD OFFICE -NAGPUR
Gyanvardhini (Ghughare) Classes,Sahakar Nagar  Nagpur,Sahakar Nagar,Nagpur,Nagpur,Maharashtra,State,,,B,HEAD OFFICE -NAGPUR
Balaji Convent  Hingna  Nagpur,Balaji Nagar  Hingna Road       Hingna  Nagpur - 440016.,Balaji Nagar  Hingna  Nagpur,Nagpur,Nagpur,Maharashtra,State,,,C,HEAD OFFICE -NAGPUR
Mount Litera Zee School,Besa Ghogali ,BESA,Nagpur,Nagpur,Maharashtra,CBSE,9487656547,,A,EAST CENTRE - NAGPUR
Nehru Vidyalaya  Hingna  Nagpur,Hingna  Nagpur,Hingna,Nagpur,Nagpur,Maharashtra,State,,,C,HEAD OFFICE -NAGPUR
Future Foundation ,Balaghat,Balaghat,Balaghat,Balaghat,Madhya Pradesh,CBSE,,,A,RESIDENTIAL CENTRE
M B Patel High school  Deori,Deori,Deori,Gondia,Gondia,Maharashtra,State,,,B,RESIDENTIAL CENTRE
Vasantrao Naik High school Warud ,Jarud,Jarud,AMRAVATI,AMRAVATI,Maharashtra,State,,,B,RESIDENTIAL CENTRE
Skyline School  Sausar ,Sausar,Sausar,Chhindwara,Chhindwara,Madhya Pradesh,State,,,A,RESIDENTIAL CENTRE
Rekha madam  Warora,Warora,Warora,Chandrapur,Chandrapur,Maharashtra,CBSE,,,A,RESIDENTIAL CENTRE
creative academy,opp nasare sabhagruha hudkeshwar road,hudkeshwar road,Nagpur,Nagpur,Maharashtra,CBSE,,,B,EAST CENTRE - NAGPUR
A+ amazing academy,hudkeshwar road opp nasare sabhagruha ,nagpur,Nagpur,Nagpur,Maharashtra,CBSE,9558467508,,C,EAST CENTRE - NAGPUR
nirmal  coaching classes,plot no 177 krishgandha chandrakiran nagar  hudkeshwar road,hudkeshwar road,Nagpur,Nagpur,Maharashtra,CBSE,7507491789,,B,EAST CENTRE - NAGPUR
Ramjyoti tution classes,govindprabhu nagar,nagpur,Nagpur,Nagpur,Maharashtra,State,9529724217,,C,EAST CENTRE - NAGPUR
swapnil tution classes,88 shrihari nagar  manewada ,nagpur,Nagpur,Nagpur,Maharashtra,CBSE,9423108908,,B,EAST CENTRE - NAGPUR
Green Hearts School  Anjangaon Surji,Near Vrundavan Palace  Paratwada Rd  Anjangaon Surji,Anjangaon Surji,ANJANGAON SURJI,AMRAVATI,Maharashtra,State,,,B,AMRAVATI CENTRE
ICON Tution Classes,Ramna Maroti Chitnis Nagar,Nagpur,Nagpur,Nagpur,Maharashtra,CBSE,9372018707,,B,EAST CENTRE - NAGPUR
Dream Tution Classes,Nandanwan Near  Sangam Hall ,Nandanwan,Nagpur,Nagpur,Maharashtra,State,7719974827,,B,EAST CENTRE - NAGPUR
K John Public School ,Besa ,Besa,Nagpur,Nagpur,Maharashtra,State,,,A,EAST CENTRE - NAGPUR
Ambition Tution Classes ,new shukrawari ,HUDKESHWAR,Nagpur,Nagpur,Maharashtra,State,,,B,EAST CENTRE - NAGPUR
Wisdom Tution Classes,new shukrawari ,New Shukrawari ,Nagpur,Nagpur,Maharashtra,State,9552458535,,B,EAST CENTRE - NAGPUR
Study Circle Point ,Hanuman nagar,Hanuman Nagar`,Nagpur,Nagpur,Maharashtra,State,9405918497,,B,EAST CENTRE - NAGPUR
Motghare Sanskrit Classes,Sakkardara Chowk,Sakkardara Chowk,Nagpur,Nagpur,Maharashtra,State,9405918497,,B,EAST CENTRE - NAGPUR
St. Vincent School ,Besa  opposite Jayanti Nagri 8 ,Besa,Nagpur,Nagpur,Maharashtra,State,9021507552,,B,EAST CENTRE - NAGPUR
Choudhary Tution Classes,Opposite of DDS Academy Hanuman Nagar,Hanuman Nagar,Nagpur,Nagpur,Maharashtra,State,8459339620,,B,EAST CENTRE - NAGPUR
